url,titulo,precio,direccion,m2_lote,banos,estacionamientos,recamaras,municipio,jardin
https://www.vivanuncios.com.mx/a-venta-casa/jardines-universidad/residencia-en-venta-en-el-alcazar/145519617,Residencia en Venta en El Alcazar,27500000,"JUAN PALOMAR Y ARIAS 1300,  Jardines Universidad, Zapopan",365,3.0,4.0,3.0,zapopan,True
https://www.vivanuncios.com.mx/a-venta-casa/fraccionamiento-solares/casa-en-venta-en-solares/145154054,Casa en Venta en Solares,10000000,"paseo solares 300,  Fraccionamiento Solares, Zapopan",222,4.0,4.0,3.0,zapopan,False
https://www.vivanuncios.com.mx/a-venta-casa/las-fuentes/casa-en-venta-en-colonia-las-fuentes-zapopon/143347143,"Casa en Venta en Colonia Las Fuentes, Zapopon.",14000000,"Santa Ana 15,  Las Fuentes, Zapopan",740,4.0,3.0,4.0,zapopan,True
https://www.vivanuncios.com.mx/a-venta-casa/hogares-de-nuevo-mexico/casa-en-venta-en-real-cantabria/147095002,Casa en Venta en Real Cantabria,2149000,"Av. Las Torres 3850 151,  Hogares de Nuevo Mexico, Zapopan",82,2.0,2.0,3.0,zapopan,False
https://www.vivanuncios.com.mx/a-venta-casa/fraccionamiento-jardin-real/casa-coto-10-jardin-real-zapopan-jalisco-mexico/142782013,"Casa Coto 10, Jardin Real, Zapopan, Jalisco, Mexico",9700000,"Colibri 68  jardin real zapopan jalisco,  Fraccionamiento Jardin Real, Zapopan",223,4.0,2.0,4.0,zapopan,False
https://www.vivanuncios.com.mx/a-venta-casa/fraccionamiento-los-suenos/casa-nueva-en-venta-dentro-del-fracc-los-suenos-zapopan/145695592,"Casa Nueva en Venta Dentro del Fracc. Los Sueños, Zapopan",19975000,"Prolongacion Av. Vallarta #2701,  Fraccionamiento Los Suenos, Zapopan",459,5.0,5.0,4.0,zapopan,True
https://www.vivanuncios.com.mx/a-venta-casa/nuevo-mexico/casa-en-condominio-en-hogares-de-nuevo-mexico/30194581,Casa en Condominio en Hogares de Nuevo México,1985000,"San Juan de Los Lagos 2120,  Nuevo Mexico, Zapopan",71,2.0,2.0,2.0,zapopan,False
https://www.vivanuncios.com.mx/a-venta-casa/valle-real/casa-en-venta-valle-real-zapopan-jalisco/146847538,"Casa en Venta Valle Real, Zapopan Jalisco",22800000,"Paseo San Arturo 2365 50 Valle Real , 45019 Zapopan, Jalisco, Mexico,  Valle Real, Zapopan",427,5.0,4.0,4.0,zapopan,False
https://www.vivanuncios.com.mx/a-venta-casa/nuevo-mexico/preciosa-residencia-en-venta-de-4-habitaciones-en-valle-imperial/145969359,Preciosa Residencia en Venta de 4 Habitaciones en Valle Imperial,6990000,"Jardines rio frio 257,  Nuevo Mexico, Zapopan",160,4.0,2.0,4.0,zapopan,True
https://www.vivanuncios.com.mx/a-venta-casa/mision-de-san-isidro/casa-de-4-recamaras-en-mirador-de-san-isidro/146503506,Casa de 4 Recamaras en Mirador de San Isidro.,4300000,"Petirojo 1484,  Mision de San Isidro, Zapopan",129,2.0,2.0,4.0,zapopan,False
https://www.vivanuncios.com.mx/a-venta-casa/los-castanos/casa-en-venta-en-fraccionamiento-los-castanos/146322808,Casa en Venta en Fraccionamiento Los Castaños,12450000,"Avenida Naciones Unidas 7500 27,  Los Castanos, Zapopan",236,3.0,3.0,4.0,zapopan,False
https://www.vivanuncios.com.mx/a-venta-casa/san-isidro/casa-en-venta-en-colinas-de-san-isidro/146694550,Casa en Venta en Colinas de San Isidro,4050000,"Av. Camino de los Parques # - 72, Colinas de San Isidro, Zapopan,  San Isidro, Zapopan",136,2.0,2.0,4.0,zapopan,False
https://www.vivanuncios.com.mx/a-venta-casa/fraccionamiento-valle-imperial/casa-en-venta-en-valle-imperial-coto-almendro/146521485,"Casa en Venta en Valle Imperial ""Coto Almendro""",5340000,"Formosa 630 78,  Fraccionamiento Valle Imperial, Zapopan",261,3.0,2.0,3.0,zapopan,False
https://www.vivanuncios.com.mx/a-venta-casa/lomas-del-refugio/casa-en-venta-en-lomas-del-refugio/90295662,Casa en Venta en Lomas del Refugio,4000000,"Yahualica 28,  Lomas Del Refugio, Zapopan",197,4.0,1.0,5.0,zapopan,False
https://www.vivanuncios.com.mx/a-venta-casa/fraccionamiento-bugambilias/casa-en-venta-bugambilias-primera-seccion/143332525,Casa en Venta Bugambilias Primera Sección,9500000,"De las Magnolias 72,,  Fraccionamiento Bugambilias, Zapopan",300,2.0,2.0,4.0,zapopan,False
https://www.vivanuncios.com.mx/a-venta-casa/santa-fe/propiedad-con-2-departamentos-en-zona-colomos-zapopan/146634251,"Propiedad con 2 Departamentos en Zona Colomos, Zapopan",6300000,"Matamoros 568,  Santa Fe, Zapopan",165,2.0,2.0,2.0,zapopan,False
https://www.vivanuncios.com.mx/a-venta-casa/fraccionamiento-pinar-de-la-venta/casa-en-venta-en-pinar-de-la-venta-zapopan-jalisco/143709969,"Casa en Venta en Pinar de La Venta Zapopan, Jalisco",8900000,"Paseo de los Fresnos # 7,  Fraccionamiento Pinar de La Venta, Zapopan",1043,5.0,4.0,5.0,zapopan,True
https://www.vivanuncios.com.mx/a-venta-casa/vistas-de-tesistan/casa-en-venta-en-tesistan/146596219,Casa en Venta en Tesistán,2300000,"Villa Hermosa 4 Valle De La Providencia 45200 La Cuchilla, Jal. Mexico,  Vistas De Tesistan, Zapopan",320,4.0,2.0,4.0,zapopan,False
https://www.vivanuncios.com.mx/a-venta-casa/fraccionamiento-solares/casa-nueva-en-venta-en-solares-en-zapopan/144476889,Casa Nueva en Venta en Solares en Zapopan,8600000,"Soare II coto 1,  Fraccionamiento Solares, Zapopan",152,4.0,2.0,3.0,zapopan,True
https://www.vivanuncios.com.mx/a-venta-casa/el-colli-urbano/casa-en-venta-colli-urbano-zapopan/145661039,"Casa en Venta - Colli Urbano, Zapopan",5400000,"VOLCAN POPOCATEPETL #4623 - 11,  El Colli Urbano, Zapopan",87,2.0,2.0,3.0,zapopan,True
https://www.vivanuncios.com.mx/a-venta-casa/fraccionamiento-camino-real/casa-camino-real-en-santa-catalina-de-sienna-471-camino-real-zapopan/142912891,"Casa Camino Real en Santa Catalina de Sienna #471, Camino Real, Zapopan",6580000,"santa catalina de siena 471,  Fraccionamiento Camino Real, Zapopan",17815,2.0,2.0,4.0,zapopan,True
https://www.vivanuncios.com.mx/a-venta-casa/fraccionamiento-pinar-de-la-venta/casa-en-venta-en-pinar-de-la-venta/144742314,Casa en Venta en Pinar de La Venta,12500000,"Paseo de la Parota 122,  Fraccionamiento Pinar de La Venta, Zapopan",1300,5.0,4.0,4.0,zapopan,False
https://www.vivanuncios.com.mx/a-venta-casa/la-magdalena/vive-en-amaranto-residencial-frente-a-parque-lineal/145217026,Vive en Amaranto Residencial Frente a Parque Lineal,1625000,"Amaranto No 174,  La Magdalena, Zapopan",79,2.0,2.0,3.0,zapopan,False
https://www.vivanuncios.com.mx/a-venta-casa/fraccionamiento-jardines-vallarta/-bonita-casa-en-remate-bancario/146258376,¡Bonita Casa en Remate Bancario!,630000,"AV NOVELISTAS 5130,  Fraccionamiento Jardines Vallarta, Zapopan",330,2.0,2.0,4.0,zapopan,False
https://www.vivanuncios.com.mx/a-venta-casa/valle-real/casa-en-venta-en-valle-real/146172915,Casa en Venta en Valle Real,14950000,"Paseo san arturo 58,  Valle Real, Zapopan",447,4.0,6.0,3.0,zapopan,False
https://www.vivanuncios.com.mx/a-venta-casa/lomas-del-valle/casa-venta-lomas-del-valle-paseo-del-prado/145932296,Casa Venta Lomas del Valle / Paseo del Prado,33900000,"Paseo del Prado 1358,  Lomas del Valle, Zapopan",860,8.0,5.0,4.0,zapopan,False
https://www.vivanuncios.com.mx/a-venta-casa/fraccionamiento-hacienda-copala/casa-en-venta-en-residencial-la-moraleja/146879196,Casa en Venta en Residencial La Moraleja,1853500,"Gibraltar 354,  Fraccionamiento Hacienda Copala, Zapopan",97,1.0,2.0,2.0,zapopan,False
https://www.vivanuncios.com.mx/a-venta-casa/ciudad-bugambilia/casa-seminueva-en-bugambilias-1ra-seccion-recamara-planta-baja/145920988,Casa Seminueva en Bugambilias 1ra Sección Recamara Planta Baja,8900000,"Paseo de las Hortencias 2877,  Ciudad Bugambilia, Zapopan",338,5.0,5.0,4.0,zapopan,False
https://www.vivanuncios.com.mx/a-venta-casa/el-bajio/casa-en-venta-en-bajio-habitat/146184777,Casa en Venta en Bajío Habitat,14500000,"Cam. Arenero 1052,  El Bajio, Zapopan",350,3.0,2.0,3.0,zapopan,False
https://www.vivanuncios.com.mx/a-venta-casa/santillana/hermosa-casa-nueva-en-soare-altanza/146707838,Hermosa Casa Nueva en Soare Altanza,7650000,"Paseo Altanza 2132 323,  Santillana, Zapopan",150,4.0,3.0,4.0,zapopan,False
https://www.vivanuncios.com.mx/a-venta-casa/fraccionamiento-solares/venta-de-casa-en-coto-privanza-solares-zapopan/144224777,"Venta de Casa en Coto Privanza Solares, Zapopan",7650000,"cto. landa 1169,  Fraccionamiento Solares, Zapopan",135,5.0,2.0,4.0,zapopan,False
https://www.vivanuncios.com.mx/a-venta-casa/auditorio/casa-en-venta-en-la-colonia-auditorio/146956595,Casa en Venta en La Colonia Auditorio,4000000,"Waterpolo 822,  Auditorio, Zapopan",110,2.0,1.0,5.0,zapopan,False
https://www.vivanuncios.com.mx/a-venta-casa/el-bosque/casa-en-venta-en-boreales-zapopan-norte-jalisco-a-10-minutos-de-costco/145947553,"Casa en Venta en Boreales, Zapopan Norte, Jalisco. a 10 Minutos de Costco",4980000,"Talavera Poniente 3474,  El Bosque, Zapopan",107,4.0,2.0,3.0,zapopan,False
https://www.vivanuncios.com.mx/a-venta-casa/lomas-de-zapopan/casa-en-venta-de-una-planta-en-lomas-de-zapopan/147072614,Casa en Venta de Una Planta en Lomas de Zapopan,3100000,"ALBURQUERQUE 789,  Lomas de Zapopan, Zapopan",122,2.0,1.0,3.0,zapopan,False
https://www.vivanuncios.com.mx/a-venta-casa/fraccionamiento-solares/casa-en-coto-valeira-solares/144453346,Casa en Coto Valeira Solares,9999000,"Paseo solares #2175 - 115, Solares, Zapopan,  Fraccionamiento Solares, Zapopan",180,5.0,2.0,5.0,zapopan,True
https://www.vivanuncios.com.mx/a-venta-casa/nuevo-mexico/casa-en-venta-capital-norte/145424752,Casa en Venta Capital Norte,4297139,"Avenida D 580,  Nuevo Mexico, Zapopan",150,3.0,2.0,4.0,zapopan,True
https://www.vivanuncios.com.mx/a-venta-casa/la-calma/casa-en-venta-en-la-calma-zapopan-jalisco/146584901,"Casa en Venta en La Calma, Zapopan Jalisco",10150000,"20°38'21.8""N 103°24'46.7""W,  La Calma, Zapopan",225,2.0,2.0,3.0,zapopan,False
https://www.vivanuncios.com.mx/a-venta-casa/fraccionamiento-valle-imperial/casa-en-venta-en-valle-imperial-zapopan-jalisco/142043180,Casa en Venta en Valle Imperial Zapopan Jalisco,4450000,"Coto Galarza 236,  Fraccionamiento Valle Imperial, Zapopan",115,3.0,2.0,4.0,zapopan,False
https://www.vivanuncios.com.mx/a-venta-casa/chapalita-inn/casa-en-renta-chapalita-inn/26040835,Casa en Renta Chapalita Inn,3500000,"FRIDA KAHLO 41,  Chapalita Inn, Zapopan",130,2.0,2.0,3.0,zapopan,False
https://www.vivanuncios.com.mx/a-venta-casa/bosques-vallarta/venta-de-casa-en-parques-vallarta/146377067,Venta de Casa en Parques Vallarta,7500000,"CALLE DEL BOSQUE 1545,  Bosques Vallarta, Zapopan",186,3.0,2.0,2.0,zapopan,False
https://www.vivanuncios.com.mx/a-venta-casa/fraccionamiento-campo-real/campo-real-zapopan-jalisco-c-p-45134-none-1517/146605906,"Campo Real, Zapopan, Jalisco, C. P. 45134, None 1517",1849000,"campo castillo 1517, campo real, zapopan, jalisco, c.p. 45134,  Fraccionamiento Campo Real, Zapopan",90,3.0,1.0,3.0,zapopan,False
https://www.vivanuncios.com.mx/a-venta-casa/fraccionamiento-solares/casa-lista-para-estrenar-en-solares/146356264,Casa Lista Para Estrenar en Solares,8600000,"Paseo Solares 2237,  Fraccionamiento Solares, Zapopan",152,4.0,2.0,3.0,zapopan,False
https://www.vivanuncios.com.mx/a-venta-casa/el-colli-urbano/bonita-casa-con-buena-ubicacion/146496196,Bonita Casa con Buena Ubicación.,4980000,"Volcan Tancitaro 2236,  El Colli Urbano, Zapopan",99,3.0,2.0,3.0,zapopan,True
https://www.vivanuncios.com.mx/a-venta-casa/fraccionamiento-valle-imperial/casa-en-venta-capital-norte-valle-imperial-zapopan-jalisco/141916693,"Casa en Venta, Capital Norte, Valle Imperial, Zapopan, Jalisco",4750000,"avenida de la cantera 406,  Fraccionamiento Valle Imperial, Zapopan",115,2.0,2.0,3.0,zapopan,True
https://www.vivanuncios.com.mx/a-venta-casa/valle-real/residencia-de-lujo-en-parques-vallarta/146003919,Residencia de Lujo en Parques Vallarta,8990000,"P.o de la Estrella 3555, Parques Vallarta,  Valle Real, Zapopan",165,4.0,3.0,3.0,zapopan,False
https://www.vivanuncios.com.mx/a-venta-casa/valle-real/casa-en-venta-de-lujo-a-un-costado-del-tec-de-monterrey/147055786,Casa en Venta de Lujo a un Costado del Tec de Monterrey,21500000,"General Ramon Corona 1100,  Valle Real, Zapopan",840,5.0,6.0,4.0,zapopan,False
https://www.vivanuncios.com.mx/a-venta-casa/fraccionamiento-valle-imperial/casa-nueva-en-venta-dentro-de-coto-egipcio-en-valle-imperial/146695133,Casa Nueva en Venta Dentro de Coto Egipcio en Valle Imperial,7350000,"Coto Egipcio 247,  Fraccionamiento Valle Imperial, Zapopan",180,3.0,2.0,3.0,zapopan,True
https://www.vivanuncios.com.mx/a-venta-casa/fraccionamiento-solares/casa-en-venta-santillana-zona-real-zapopan-jalisco/145698000,"Casa en Venta Santillana Zona Real, Zapopan, Jalisco",6750000,"Coto 2 santillana C11,  Fraccionamiento Solares, Zapopan",133,3.0,2.0,3.0,zapopan,False
https://www.vivanuncios.com.mx/a-venta-casa/paraisos-del-colli/casa-venta-paraisos-del-colli/143366369,Casa Venta Paraisos del Colli,2500000,"nispero 1332,  Paraisos Del Colli, Zapopan",141,4.0,1.0,7.0,zapopan,False
https://www.vivanuncios.com.mx/a-venta-casa/fraccionamiento-valle-imperial/casa-en-venta-privada-escorial-valle-imperial/146039669,"Casa en Venta Privada Escorial, Valle Imperial",5990000,"Priv. Escorial 95, fraccionamiento valle imperial, zapopan jalisco,  Fraccionamiento Valle Imperial, Zapopan",209,3.0,2.0,3.0,zapopan,False
https://www.vivanuncios.com.mx/a-venta-casa/natura-bosque-residencial/bonita-casa-en-venta-en-natura-residencial/146187216,Bonita Casa en Venta en Natura Residencial,4200000,"AVENIDA PASEO NATURA 40,  Natura Bosque Residencial, Zapopan",111,3.0,2.0,4.0,zapopan,False
https://www.vivanuncios.com.mx/a-venta-casa/nuevo-mexico/casa-en-venta-residencial-magnolias-col-nuevo-mexico-zapopan/146563271,Casa en Venta Residencial Magnolias Col. Nuevo México Zapopan,2900000,"av juan gil preciado no. 6507,  Nuevo Mexico, Zapopan",111,3.0,2.0,4.0,zapopan,False
https://www.vivanuncios.com.mx/a-venta-casa/nuevo-mexico/casa-en-venta-en-conjunto-villas-del-valle-a-un-costado-del-club-de-golf-valle-imperial/147116420,Casa en Venta en Conjunto Villas del Valle a un Costado del Club de Golf Valle Imperial,658000,"Valle Escondido 29,  Nuevo Mexico, Zapopan",90,1.0,1.0,2.0,zapopan,False
https://www.vivanuncios.com.mx/a-venta-casa/fraccionamiento-parques-de-tesistan/casa-en-venta-en-tesistan/147015584,Casa en Venta en Tesistán,2790000,"Fray Miguel Pieras 1319 185,  Fraccionamiento Parques de Tesistan, Zapopan",80,3.0,2.0,3.0,zapopan,False
https://www.vivanuncios.com.mx/a-venta-casa/fraccionamiento-jardines-de-santa-ana/casa-en-venta-en-jardines-de-santa-ana-zapopan-jalisco/145915768,"Casa en Venta en Jardines de Santa Ana, Zapopan, Jalisco",2600000,"Guadalupe Victoria 3014  , Jardines de Santa Ana , 45230 Zapopan, Jalisco, Mexico,  Fraccionamiento Jardines de Santa Ana, Zapopan",112,3.0,2.0,3.0,zapopan,False
https://www.vivanuncios.com.mx/a-venta-casa/auditorio/casa-en-venta-zona-auditorio-benito-juarez/147056175,Casa en Venta Zona Auditorio Benito Juarez,4490000,"Ley Iglesias 100,  Auditorio, Zapopan",90,3.0,2.0,3.0,zapopan,False
https://www.vivanuncios.com.mx/a-venta-casa/ciudad-bugambilia/casa-en-venta-cd-bugambilias-segunda-seccion-en-coto/144981144,"Casa en Venta Cd Bugambilias Segunda Seccion, en Coto",14000000,"av del  reno poniente 100,  Ciudad Bugambilia, Zapopan",497,4.0,4.0,3.0,zapopan,True
https://www.vivanuncios.com.mx/a-venta-casa/villa-de-los-belenes/venta-de-casa-en-zapopan-colonia-villa-de-los-belenes/146040732,Venta de Casa en Zapopan Colonia Villa de Los Belenes,1081500,"JOSE MARIA HIDALGO 592,  Villa de los Belenes, Zapopan",58,2.0,2.0,3.0,zapopan,False
https://www.vivanuncios.com.mx/a-venta-casa/arboledas/casa-en-venta-colonia-arboledas-zapopan-amueblada/146468009,Casa en Venta Colonia Arboledas Zapopan Amueblada,11500000,"PTOLOMEO 2916,  Arboledas , Zapopan",300,7.0,2.0,7.0,zapopan,False
https://www.vivanuncios.com.mx/a-venta-casa/virreyes-residencial/casa-dentro-de-coto-el-rincon-virreyes-residencial/145961529,Casa Dentro de Coto El Rincón - Virreyes Residencial,13500000,"C. Eca Do Queiros 991, Jardines Universidad, Zapopan, Jal.,  Virreyes Residencial, Zapopan",312,4.0,2.0,4.0,zapopan,False
https://www.vivanuncios.com.mx/a-venta-casa/chapalita-inn/casa-en-venta-chapalita-inn/146399147,"Casa en Venta, Chapalita Inn",4650000,"Los tintores 46,  Chapalita Inn, Zapopan",95,2.0,1.0,4.0,zapopan,False
https://www.vivanuncios.com.mx/a-venta-casa/san-juan-de-ocotan/casa-en-venta-en-condominio-sole/144083983,Casa en Venta en Condominio Sole,7300000,"Avenida General Ramon Corona 2515,  San Juan de Ocotan, Zapopan",185,5.0,3.0,5.0,zapopan,False
https://www.vivanuncios.com.mx/a-venta-casa/lagos-del-country/hermosa-casa-con-excelente-ubicacion-en-av-patria-zapopan/146279083,"Hermosa Casa con Excelente Ubicación en Av Patria, Zapopan",7100000,"avenida patria 2520,  Lagos Del Country , Zapopan",192,3.0,2.0,5.0,zapopan,False
https://www.vivanuncios.com.mx/a-venta-casa/la-estancia/se-vende-hermosa-casa-en-la-estancia/146632294,Se Vende Hermosa Casa en La Estancia,6480000,"FRANZ SHUBERT 5043,  La Estancia, Zapopan",199,3.0,1.0,3.0,zapopan,False
https://www.vivanuncios.com.mx/a-venta-casa/la-calma/-aprovecha-esta-gran-oportunidad-de-inversion/145505137,¡Aprovecha Esta Gran Oportunidad de Inversión!,695000,"C. Andromeda 3637, La Calma, 45080 Zapopan, Jal.,  La Calma, Zapopan",295,3.0,2.0,4.0,zapopan,False
https://www.vivanuncios.com.mx/a-venta-casa/jardines-universidad/casa-en-venta-en-bosque-de-los-lagos-jardines-univesidad-zapopan/146852453,"Casa en Venta en Bosque de Los Lagos, Jardines Univesidad, Zapopan",39800000,"Av. Juan Palomar y Arias 1180, Jardines Universidad, 45136 Zapopan, Jal.,  Jardines Universidad, Zapopan",580,6.0,5.0,4.0,zapopan,False
https://www.vivanuncios.com.mx/a-venta-casa/conjunto-zapopan/casa-muy-amplia-entre-plaza-patria-y-la-seattle/146503547,Casa Muy Amplia Entre Plaza Patria y La Seattle,12500000,"Mexico Independiente 765,  Conjunto Zapopan, Zapopan",577,4.0,3.0,5.0,zapopan,False
https://www.vivanuncios.com.mx/a-venta-casa/fraccionamiento-jardines-de-guadalupe/casa-en-venta-en-jardines-de-guadalupe/142442952,Casa en Venta en Jardines de Guadalupe,10600000,"Doctores 774,  Fraccionamiento Jardines de Guadalupe, Zapopan",300,3.0,3.0,4.0,zapopan,False
https://www.vivanuncios.com.mx/a-venta-casa/altavista-residencial/casa-en-renta-alta-vista/143372772,Casa en Renta Alta Vista,3990000,"Alta vista 450,  Altavista Residencial, Zapopan",145,2.0,2.0,3.0,zapopan,True
https://www.vivanuncios.com.mx/a-venta-casa/constitucion/casa-en-constitucion-en-remate/144882375,Casa en Constitucion en Remate,570000,"Ing. Jorge Villasenor 375,  Constitucion, Zapopan",120,2.0,1.0,3.0,zapopan,False
https://www.vivanuncios.com.mx/a-venta-casa/bosques-vallarta/casa-en-venta-en-bosques-vallarta-zapopan/145411472,"Casa en Venta en Bosques Vallarta, Zapopan",6770000,"Circuito del Bosque 217, Bosques Vallarta, Zapopan, Jalisco,  Bosques Vallarta, Zapopan",165,3.0,2.0,3.0,zapopan,False
https://www.vivanuncios.com.mx/a-venta-casa/bosques-vallarta/casa-en-venta-en-parques-vallarta-zapopan-jalisco/146649763,"Casa en Venta en Parques Vallarta, Zapopan, Jalisco",7000000,"paseo del norte 3430,  Bosques Vallarta, Zapopan",165,3.0,2.0,4.0,zapopan,False
https://www.vivanuncios.com.mx/a-venta-casa/fraccionamiento-bugambilias/casa-en-venta-bugambilias/143543673,Casa en Venta. Bugambilias,20000000,"Bugambilias 2da Seccion. Circuito Lince,  Fraccionamiento Bugambilias, Zapopan",840,4.0,8.0,3.0,zapopan,True
https://www.vivanuncios.com.mx/a-venta-casa/fraccionamiento-rinconada-del-parque/propiedad-uso-de-suelo-mixto-en-venta-frente-a-parque-metropolitano/142461435,Propiedad Uso de Suelo Mixto en Venta Frente a Parque Metropolitano,18450000,"INDEPENDENCIA  141,  Fraccionamiento Rinconada Del Parque, Zapopan",375,3.0,4.0,3.0,zapopan,True
https://www.vivanuncios.com.mx/a-venta-casa/los-robles/venta-de-casa-en-los-robles-coto-encinos/146093425,Venta de Casa en Los Robles Coto Encinos,7850000,"COTO ENCINOS INT 16 J,  Los Robles, Zapopan",261,4.0,5.0,4.0,zapopan,True
https://www.vivanuncios.com.mx/a-venta-casa/juan-manuel-vallarta/casa-en-residencial-porta-magna-con-alberca-en-jardines-vallarta/145886944,Casa en Residencial Porta Magna con Alberca en Jardines Vallarta,1200000,"PEDRO ALARCON  45,  Juan Manuel Vallarta, Zapopan",151,3.0,2.0,3.0,zapopan,True
https://www.vivanuncios.com.mx/a-venta-casa/ciudad-bugambilia/casa-nueva-en-venta-bugambilias-segunda-secion/146746436,"Casa Nueva en Venta, Bugambilias, Segunda Secion",14000000,"ciudad bugambilias 2aseccion,  Ciudad Bugambilia, Zapopan",420,4.0,4.0,4.0,zapopan,False
https://www.vivanuncios.com.mx/a-venta-casa/fraccionamiento-bugambilias/venta-casa-en-bugambilias-segunda-seccion/143982933,Venta Casa en Bugambilias Segunda Sección,8900000,"Retorno del Reno Sur 1634,  Fraccionamiento Bugambilias, Zapopan",420,2.0,2.0,5.0,zapopan,True
https://www.vivanuncios.com.mx/a-venta-casa/valle-real/hermosa-casa-en-coto-exclusivo-dentro-de-valle-real/146707863,Hermosa Casa en Coto Exclusivo Dentro de Valle Real,45000000,"Paseo San Guillermo 2171 1,  Valle Real, Zapopan",995,5.0,4.0,4.0,zapopan,False
https://www.vivanuncios.com.mx/a-venta-casa/fraccionamiento-valle-imperial/casa-en-venta-y-renta-valle-imperial-coto-20-imperioaleman/146551664,Casa en Venta y Renta Valle Imperial Coto 20 Imperioaleman,8400000,"Avenida Paseo de los Emperadores 1560,  Fraccionamiento Valle Imperial, Zapopan",200,5.0,4.0,4.0,zapopan,False
https://www.vivanuncios.com.mx/a-venta-casa/el-colli-urbano/casa-en-venta-en-el-colli-urbano/146273878,Casa en Venta en El Colli Urbano,2990000,"Calle Volcan Paricutin 5809,  El Colli Urbano, Zapopan",65,1.0,1.0,2.0,zapopan,False
https://www.vivanuncios.com.mx/a-venta-casa/conjunto-zapopan/hermosa-casa-en-venta-en-la-colonia-seattle/146826257,Hermosa Casa en Venta en La Colonia Seattle,12900000,"Unidad Nacional 3096 lote 13,  Conjunto Zapopan, Zapopan",332,3.0,2.0,3.0,zapopan,False
https://www.vivanuncios.com.mx/a-venta-casa/san-juan-de-ocotan/casa-en-venta-en-palma-real-en-zapopan/145887808,Casa en Venta en Palma Real en Zapopan,15800000,"Palma Real 1,  San Juan de Ocotan, Zapopan",345,7.0,6.0,4.0,zapopan,True
https://www.vivanuncios.com.mx/a-venta-casa/periquera/casa-en-venta-en-valle-imperial/145446018,Casa en Venta en Valle Imperial,10900000,"Boulevard Valle Imperial 257 .,  Periquera, Zapopan",160,4.0,2.0,4.0,zapopan,False
https://www.vivanuncios.com.mx/a-venta-casa/jardines-del-valle/casa-venta-el-secreto-jardines-del-valle/144763384,Casa Venta El Secreto Jardines del Valle,4500000,"Valle de san marcos 100,  Jardines del Valle, Zapopan",180,3.0,2.0,3.0,zapopan,False
https://www.vivanuncios.com.mx/a-venta-casa/lomas-del-seminario/casa-en-venta-en-la-estancia-zapopan-jalisco/146520691,"Casa en Venta en La Estancia, Zapopan Jalisco.",8200000,"Federico Chopin 4944,  Lomas Del Seminario, Zapopan",200,2.0,2.0,5.0,zapopan,False
https://www.vivanuncios.com.mx/a-venta-casa/el-centinela/casa-en-venta-rancho-el-centinela/144494762,Casa en Venta Rancho El Centinela,7490000,"Parota 8 colonia Rancho el Centinela,  El Centinela, Zapopan",378,2.0,2.0,3.0,zapopan,True
https://www.vivanuncios.com.mx/a-venta-casa/mirador-del-sol/casa-en-venta-en-mirador-del-sol-zapopan/145223296,"Casa en Venta en Mirador del Sol, Zapopan.",4000000,"Punchan 4808,  Mirador Del Sol, Zapopan",137,3.0,1.0,4.0,zapopan,False
https://www.vivanuncios.com.mx/a-venta-casa/fraccionamiento-valle-imperial/se-vende-casa-en-coto-cerezos-valle-imperial-zapopan/144214285,"Se Vende Casa en Coto Cerezos, Valle Imperial Zapopan",4650000,"bv. valle imperial 1329,  Fraccionamiento Valle Imperial, Zapopan",120,3.0,2.0,3.0,zapopan,False
https://www.vivanuncios.com.mx/a-venta-casa/pinar-de-la-calma/casa-duplex-p-b-en-venta-en-pinar-de-la-calma/147032046,Casa Duplex P. B. en Venta en Pinar de La Calma,3200000,"Copilco 5921,  Pinar de La Calma, Zapopan",124,2.0,2.0,3.0,zapopan,False
https://www.vivanuncios.com.mx/a-venta-casa/fraccionamiento-villa-verona/casa-de-lujo-en-villa-verona-completamente-nueva/144651862,Casa de Lujo en Villa Verona Completamente Nueva,25100000,"Calle O 131,  Fraccionamiento Villa Verona, Zapopan",322,5.0,4.0,4.0,zapopan,False
https://www.vivanuncios.com.mx/a-venta-casa/la-calma/venta-de-casa-en-la-calma-una-sola-planta/146258144,Venta de Casa en La Calma. ¡Una Sola Planta!,6500000,"Ramon Corona 2996,  La Calma, Zapopan",161,2.0,3.0,3.0,zapopan,False
https://www.vivanuncios.com.mx/a-venta-casa/chapalita-oriente/casa-en-venta-en-la-colonia-chapalita/145845286,Casa en Venta en La Colonia Chapalita,27000000,"Aurora 254,  Chapalita Oriente, Zapopan",1500,4.0,4.0,5.0,zapopan,False
https://www.vivanuncios.com.mx/a-venta-casa/fraccionamiento-solares/casa-bonita-en-venta-en-althea-solares-coto-11-4-rec-casa-club-con-alberca/146673264,"Casa Bonita en Venta en Althea Solares Coto 11, 4 Rec, Casa Club con Alberca",6800000,"Av. Paseo de la Estrella 1177,  Fraccionamiento Solares, Zapopan",169,3.0,3.0,4.0,zapopan,True
https://www.vivanuncios.com.mx/a-venta-casa/fraccionamiento-bugambilias/casa-en-venta-en-bugambilias-1-era-seccion-frente-a-parque-y-a-plaza-bugambilias/146754689,Casa en Venta en Bugambilias 1 Era Sección Frente a Parque y a Plaza Bugambilias,8000000,"Paseo de los Jazmines 3030,  Fraccionamiento Bugambilias, Zapopan",371,3.0,3.0,4.0,zapopan,True
https://www.vivanuncios.com.mx/a-venta-casa/fraccionamiento-el-olivo-coto-residencial/casa-fraccionamiento-olivos-residencial-general-ramon-corona-zapopan-jalisco/145423360,"Casa Fraccionamiento Olivos Residencial, General Ramon Corona, Zapopan, Jalisco",25000000,"Av General Ramon Corona 2748 fraccionamiento los olivos Zapopan Jalisco,  Fraccionamiento El Olivo Coto Residencial, Zapopan",321,6.0,7.0,4.0,zapopan,False
https://www.vivanuncios.com.mx/a-venta-casa/santa-ana-tepetitlan/casa-en-venta-barlovento-residencial/146608372,Casa en Venta Barlovento Residencial,4468000,"Prol Guardia Nacional 2274,  Santa Ana Tepetitlan, Zapopan",84,3.0,2.0,3.0,zapopan,False
