url,titulo,precio,direccion,m2_lote,banos,estacionamientos,recamaras,municipio,jardin
https://www.vivanuncios.com.mx/a-venta-casa/fraccionamiento-jardines-de-santa-isabel/casa-en-venta-en-fraccionamiento-jardines-de-santa-isabel/145410378,Casa en Venta en Fraccionamiento Jardines de Santa Isabel,24400000,"San Pascual 4766. Santa Isabel. Zapopan Jal.,  Fraccionamiento Jardines de Santa Isabel, Guadalajara",790,4.0,4.0,4.0,guadalajara,False
https://www.vivanuncios.com.mx/a-venta-casa/ladron-de-guevara/casa-en-venta-ladron-de-guevara-guadalajara-jalisco/143617976,"Casa en Venta Ladron de Guevara Guadalajara, Jalisco.",14800000,"Hidalgo 2042,  Ladron de Guevara, Guadalajara",397,3.0,4.0,4.0,guadalajara,False
https://www.vivanuncios.com.mx/a-venta-casa/providencia/casa-en-venta-en-providencia-jose-maria-vigil-2807/146479929,Casa en Venta en Providencia - Jóse María Vigil 2807,11300000,"Jose Maria Vigil 2807,  Providencia, Guadalajara",329,3.0,3.0,4.0,guadalajara,False
https://www.vivanuncios.com.mx/a-venta-casa/providencia/casa-en-renta-y-venta-en-providencia-guadalajara-jalisco/146782470,Casa en Renta y Venta en Providencia Guadalajara Jalisco,43900000,"Hipodromo #2100, Colomos Providencia, Guadalajara,  Providencia, Guadalajara",1064,6.0,10.0,4.0,guadalajara,True
https://www.vivanuncios.com.mx/a-venta-casa/bosques-de-la-victoria/casa-en-venta-en-bosques-de-la-victoria-guadalajara/146670305,"Casa en Venta en Bosques de La Victoria, Guadalajara",14200000,"Calle Peninsula #2573,  Bosques de La Victoria, Guadalajara",322,4.0,3.0,5.0,guadalajara,True
https://www.vivanuncios.com.mx/a-venta-casa/atlas/casa-venta-colonia-atlas-guadalajara/146914623,"Casa Venta, Colonia Atlas, Guadalajara.",3500000,"Rio Ocotlan 1374,  Atlas, Guadalajara",69,1.0,1.0,4.0,guadalajara,False
https://www.vivanuncios.com.mx/a-venta-casa/atlas/casa-venta-colonia-atlas-guadalajara/146261852,"Casa Venta, Colonia Atlas, Guadalajara.",2650000,"rio volga 1548,  Atlas, Guadalajara",88,2.0,1.0,4.0,guadalajara,False
https://www.vivanuncios.com.mx/a-venta-casa/country-club/country-club-gran-lujo-3-recamaras-5-autos-tiene-una-casa-extra-de-2-recamaras-en-el-jardin/146655488,"Country Club, Gran Lujo, 3 Recámaras, 5 Autos, Tiene Una Casa Extra de 2 Recámaras en El Jardín",30120000,"Mar de Celebes No. 1815, Col. Country Club, Guadalajara,  Country Club, Guadalajara",687,3.0,5.0,3.0,guadalajara,True
https://www.vivanuncios.com.mx/a-venta-casa/providencia/casa-u-oficina-en-venta-prados-providencia-guadalajara/145791226,Casa U Oficina en Venta Prados Providencia Guadalajara,11500000,"Ottawa 1139. Italia Providencia, Guadalajara Jal.,  Providencia, Guadalajara",242,2.0,1.0,3.0,guadalajara,False
https://www.vivanuncios.com.mx/a-venta-casa/jardines-de-la-paz/casa-en-venta-en-jardines-de-la-paz-luis-gonzalez-obrador-3282/146833122,Casa en Venta en Jardines de La Paz - Luis González Obrador 3282,7390000,"Luis Gonzalez Obregon 3282,  Jardines de La Paz, Guadalajara",120,4.0,5.0,4.0,guadalajara,False
https://www.vivanuncios.com.mx/a-venta-casa/americana/casa-comercial-venta-colonia-americana/145931122,"Casa Comercial Venta, Colonia Americana",13480000,"Camarena 25,  Americana, Guadalajara",592,2.0,2.0,8.0,guadalajara,False
https://www.vivanuncios.com.mx/a-venta-casa/providencia/casa-en-venta-en-colomos-providencia-alberta-2166/145888258,Casa en Venta en Colomos Providencia - Alberta 2166,18900000,"Alberta 2166,  Providencia, Guadalajara",430,3.0,5.0,3.0,guadalajara,False
https://www.vivanuncios.com.mx/a-venta-casa/providencia/venta-de-casa-de-una-planta-col-providencia/143999262,Venta de Casa de Una Planta - Col. Providencia.,8100000,"Justicia 2660,  Providencia, Guadalajara",240,3.0,1.0,3.0,guadalajara,False
https://www.vivanuncios.com.mx/a-venta-casa/santa-elena-alcalde-poniente/casa-en-santa-elena-alcalde-nueva/146805069,"Casa en Santa Elena Alcalde, Nueva.",4750000,"linares 3060,  Santa Elena Alcalde Poniente, Guadalajara",129,2.0,2.0,3.0,guadalajara,False
https://www.vivanuncios.com.mx/a-venta-casa/providencia/casa-en-venta-en-providencia/144358710,Casa en Venta en Providencia,10150000,"Calle Bonifacio Andrada 2933,  Providencia, Guadalajara",250,3.0,3.0,5.0,guadalajara,False
https://www.vivanuncios.com.mx/a-venta-casa/fraccionamiento-jardines-del-country/casa-en-venta-jardines-del-country/144096496,Casa en Venta Jardines del Country,4750000,"mesones 2005,  Fraccionamiento Jardines Del Country, Guadalajara",160,1.0,1.0,5.0,guadalajara,False
https://www.vivanuncios.com.mx/a-venta-casa/fraccionamiento-colinas-de-san-javier/casa-en-venta-en-colinas-de-san-javier/145585059,Casa en Venta en Colinas de San Javier,49900000,"P.o del Torreon 1805,  Fraccionamiento Colinas de San Javier, Guadalajara",756,5.0,3.0,4.0,guadalajara,False
https://www.vivanuncios.com.mx/a-venta-casa/lomas-de-guevara/-oportunidad-casa-para-remodelar-manuel-acuna-2704-remate-a-media-cuadra-de-casa-jalisco/145750865,! Oportunidad! Casa Para Remodelar Manuel Acuña 2704 Remate (A Media Cuadra de Casa Jalisco,26800000,"AV MANUEL ACUNA  2704,  Lomas de Guevara, Guadalajara",700,4.0,6.0,5.0,guadalajara,False
https://www.vivanuncios.com.mx/a-venta-casa/el-rosario/casa-en-venta-en-el-rosario/145734241,Casa en Venta en El Rosario,12000000,"Rio Ometepec 1554,  El Rosario, Guadalajara",279,5.0,2.0,4.0,guadalajara,False
https://www.vivanuncios.com.mx/a-venta-casa/unidad-habitacional-el-sauz-acueducto/casa-en-venta-nueva-por-colon-y-patria-en-privada/146689834,Casa en Venta Nueva por Colon y Patria en Privada,3200000,"AV. COLON 4090,  Unidad habitacional El Sauz Acueducto, Guadalajara",102,3.0,1.0,3.0,guadalajara,False
https://www.vivanuncios.com.mx/a-venta-casa/la-federacha/casa-en-venta-en-col-la-esperanza-federacha/146051805,Casa en Venta en Col La Esperanza Federacha,3800000,"Montes Urales 2858,  La Federacha, Guadalajara",344,2.0,4.0,3.0,guadalajara,False
https://www.vivanuncios.com.mx/a-venta-casa/vallarta-poniente/chapala-80-vallarta-poniente/146461892,"Chapala 80, Vallarta Poniente",9500000,"Chapala 80,  Vallarta Poniente, Guadalajara",166,4.0,2.0,4.0,guadalajara,True
https://www.vivanuncios.com.mx/a-venta-casa/arcos-vallarta/casa-o-terreno-en-venta-en-colonia-vallarta-guadalajara-ideal-para-hacer-edificio/146329847,"Casa o Terreno en Venta en Colonia Vallarta, Guadalajara Ideal Para Hacer Edificio",11000000,"Benjamin Romero 18,  Arcos Vallarta, Guadalajara",402,2.0,4.0,3.0,guadalajara,False
https://www.vivanuncios.com.mx/a-venta-casa/independencia/casa-independencia-renovada/146921168,"Casa Independencia, Renovada",4950000,"SIERRA LEONA 1944,  Independencia, Guadalajara",167,2.0,2.0,3.0,guadalajara,False
https://www.vivanuncios.com.mx/a-venta-casa/fraccionamiento-jardines-del-country/casa-renovada-con-espacios-amplios-jardin-con-alberca-y-roof-garden/146306341,"Casa Renovada con Espacios Amplios, Jardín con Alberca y Roof Garden",7400000,"Lago de Catemaco 2258,  Fraccionamiento Jardines Del Country, Guadalajara",230,5.0,2.0,4.0,guadalajara,False
https://www.vivanuncios.com.mx/a-venta-casa/atlas/casa-en-venta/146166750,Casa en Venta,3700000,"Rio Zapotlanejo 1360,  Atlas, Guadalajara",154,2.0,3.0,3.0,guadalajara,False
https://www.vivanuncios.com.mx/a-venta-casa/circunvalacion-belisario/casa-en-venta-remodelada-por-la-monumental-guadalajara/147022349,"Casa en Venta Remodelada por La Monumental, Guadalajara.",3080000,"Calle Puerto Soto La Marina 1784,  Circunvalacion Belisario, Guadalajara",75,2.0,1.0,2.0,guadalajara,False
https://www.vivanuncios.com.mx/a-venta-casa/fraccionamiento-jardines-alcalde/casa-en-venta-cerca-del-parque-amarillo-jardines-alcalde/145615820,Casa en Venta Cerca del Parque Amarillo Jardines Alcalde,6100000,"Calle Jose Ignacio Solorzano 612,  Fraccionamiento Jardines Alcalde, Guadalajara",301,3.0,3.0,4.0,guadalajara,False
https://www.vivanuncios.com.mx/a-venta-casa/jardines-del-bosque/se-vende-casa-en-jardines-del-bosque/146638697,Se Vende Casa en Jardines del Bosque,6780000,"Tormenta 847,  Jardines del Bosque, Guadalajara",224,3.0,2.0,2.0,guadalajara,True
https://www.vivanuncios.com.mx/a-venta-casa/independencia/casa-en-venta-colonia-independencia-con-recamara-abajo-o-estudio-por-el-estadio/146313975,"Casa en Venta Colonia Independencia con Recámara Abajo o Estudio, por El Estadio",5000000,"A UNAS CUADRAS DEL ESTADIO Calle Siete Colinas 1772, Colonia Independencia, Guadalajara, Jalisco, Mexico,  Independencia, Guadalajara",161,2.0,2.0,4.0,guadalajara,True
https://www.vivanuncios.com.mx/a-venta-casa/fraccionamiento-jardines-de-los-historiadores/casa-en-venta-en-guadalajara-jalisco-jardines-de-los-historiadores/146960861,"Casa en Venta en Guadalajara, Jalisco (Jardines de Los Historiadores)",6290000,"Calle Jose Martinez Sotomayor 896,  Fraccionamiento Jardines de los Historiadores, Guadalajara",156,3.0,3.0,4.0,guadalajara,False
https://www.vivanuncios.com.mx/a-venta-casa/americana/casa-en-venta-en-la-colonia-americana/147026659,Casa en Venta en La Colonia Americana,18900000,"Avenida la Paz 2316,  Americana, Guadalajara",356,1.0,3.0,6.0,guadalajara,False
https://www.vivanuncios.com.mx/a-venta-casa/colonia-huentitan-el-alto/casa-en-venta-en-providencia/146021757,Casa en Venta en Providencia,15000000,"Antofagasta 2219,  Colonia Huentitan El Alto, Guadalajara",483,5.0,5.0,5.0,guadalajara,False
https://www.vivanuncios.com.mx/a-venta-casa/americana/casa-de-3-recamaras-junto-a-calle-libertad/146645673,Casa de 3 Recamaras Junto a Calle Libertad,9500000,"Argentina 370,  Americana, Guadalajara",151,2.0,1.0,3.0,guadalajara,False
https://www.vivanuncios.com.mx/a-venta-casa/americana/oportunidad-casa-en-venta-col-americana/142698472,Oportunidad! Casa en Venta Col. Americana.,10499000,"Mexicaltzingo 1957,  Americana, Guadalajara",327,3.0,4.0,8.0,guadalajara,False
https://www.vivanuncios.com.mx/a-venta-casa/fraccionamiento-colomos-providencia/casa-en-venta-en-colomos-providencia-guadalajara-jal/146826536,"Casa en Venta en Colomos Providencia, Guadalajara Jal.",12750000,"La Guaira  al 2900,  Fraccionamiento Colomos Providencia, Guadalajara",213,2.0,2.0,3.0,guadalajara,True
https://www.vivanuncios.com.mx/a-venta-casa/chapalita/propiedad-excelente-ubicacion-en-chapalita/143146503,Propiedad Excelente Ubicación en Chapalita,11250000,"Capuchinas 2961, Col. Chapalita, Guadalajara, Jalisco,  Chapalita, Guadalajara",384,2.0,2.0,3.0,guadalajara,True
https://www.vivanuncios.com.mx/a-venta-casa/8-de-julio/uso-multiple-gobernador-curiel-y-lazaro-cardenas/146149130,"Uso Múltiple, Gobernador Curiel y Lázaro Cárdenas",5500000,"ZENZONTLE 789,  8 de Julio , Guadalajara",226,5.0,1.0,10.0,guadalajara,False
https://www.vivanuncios.com.mx/a-venta-casa/fraccionamiento-lomas-del-country/casa-en-venta-mar-negro/144829719,Casa en Venta Mar Negro,13000000,"Mar Negro 1416,  Fraccionamiento Lomas Del Country, Guadalajara",521,4.0,2.0,4.0,guadalajara,False
https://www.vivanuncios.com.mx/a-venta-casa/unidad-habitacional-plutarco-elias-calles/casa-en-venta-en-col-plutarco-elias-calles/146588993,Casa en Venta en Col. Plutarco Elías Calles,2200000,"Hda. La Candelaria 2284,  Unidad habitacional Plutarco Elias Calles , Guadalajara",64,1.0,1.0,2.0,guadalajara,False
https://www.vivanuncios.com.mx/a-venta-casa/bosques-de-la-victoria/hermosa-casa-en-venta-en-bosques-de-la-victoria/146678864,Hermosa Casa en Venta en Bosques de La Victoria,8350000,"isla cleofas 2385,  Bosques de La Victoria, Guadalajara",202,7.0,2.0,6.0,guadalajara,False
https://www.vivanuncios.com.mx/a-venta-casa/jardines-del-bosque/casas-en-preventa-en-jardines-del-bosque-guadalajara/144347785,Casas en Preventa en Jardines del Bosque Guadalajara,8597100,"CALLE LA LUNA 2863,  Jardines del Bosque, Guadalajara",205,2.0,2.0,3.0,guadalajara,False
https://www.vivanuncios.com.mx/a-venta-casa/circunvalacion-belisario/casa-en-venta-remodelada-por-la-monumental-guadalajara/147040395,"Casa en Venta Remodelada por La Monumental, Guadalajara.",3080000,"puerto soto la marina 1784,  Circunvalacion Belisario, Guadalajara",75,2.0,1.0,2.0,guadalajara,False
https://www.vivanuncios.com.mx/a-venta-casa/jardines-el-sauz/venta-de-casa-en-jardines-del-sauz-guadalajara/146997441,Venta de Casa en Jardines del Sauz Guadalajara,428303,"Av Jaime Torres Bodet 3224,  Jardines El Sauz, Guadalajara",70,1.0,1.0,3.0,guadalajara,True
https://www.vivanuncios.com.mx/a-venta-casa/barrio-santa-teresita/casa-en-venta-en-colonia-santa-tere-guadalajara-jalisco/145586187,"Casa en Venta en Colonia Santa Tere Guadalajara, Jalisco",7350000,"Joaquin Angulo 982,  Barrio Santa Teresita, Guadalajara",220,3.0,1.0,3.0,guadalajara,False
https://www.vivanuncios.com.mx/a-venta-casa/providencia/casa-en-colomos-providencia/147019564,Casa en Colomos Providencia,13500000,"Antofagasta 2248,  Providencia, Guadalajara",415,5.0,5.0,5.0,guadalajara,True
https://www.vivanuncios.com.mx/a-venta-casa/americana/casa-en-venta-colonia-americana/146524282,Casa en Venta Colonia Americana,11500000,"GENERAL SAN MARTIN 1,  Americana, Guadalajara",315,2.0,2.0,3.0,guadalajara,False
https://www.vivanuncios.com.mx/a-venta-casa/fraccionamiento-rinconada-santa-rita/casa-en-venta-en-rinconada-santa-rita/146885310,Casa en Venta en Rinconada Santa Rita,20800000,"Manuel Acuna 3540,  Fraccionamiento Rinconada Santa Rita, Guadalajara",500,4.0,6.0,5.0,guadalajara,False
https://www.vivanuncios.com.mx/a-venta-casa/independencia/residencia-en-venta-en-monte-tabor-guadalajara/147010752,"Residencia en Venta en Monte Tabor, Guadalajara",9900000,"Monte Tabor 198,  Independencia, Guadalajara",252,3.0,3.0,4.0,guadalajara,True
https://www.vivanuncios.com.mx/a-venta-casa/la-loma/oportunidad-unica-de-casa-en-la-loma/144940328,Oportunidad Unica de Casa en La Loma,5000000,"Calzada Revolucion 1634,  La Loma, Guadalajara",224,3.0,3.0,4.0,guadalajara,False
https://www.vivanuncios.com.mx/a-venta-casa/san-antonio/casa-en-venta-calle-medrano/142430309,"Casa en Venta, Calle Medrano",3600000,"Medrano 2235,  San Antonio, Guadalajara",213,3.0,1.0,6.0,guadalajara,False
https://www.vivanuncios.com.mx/a-venta-casa/providencia/casa-en-venta-en-providencia/145343597,Casa en Venta en Providencia,8490000,"Rio de Janeiro 2085,  Providencia, Guadalajara",180,3.0,1.0,5.0,guadalajara,False
https://www.vivanuncios.com.mx/a-venta-casa/ladron-de-guevara/casa-en-venta-en-col-ladron-de-guevara/145508269,Casa en Venta en Col. Ladrón de Guevara,8200000,"Fray Luis de Palacio 443. Col. Ladron de Guevara. Guadalajara Jal.,  Ladron de Guevara, Guadalajara",94,3.0,1.0,3.0,guadalajara,False
https://www.vivanuncios.com.mx/a-venta-casa/fraccionamiento-italia-providencia/casa-en-venta-en-col-providencia/145040323,Casa en Venta en Col. Providencia,13490000,"C. Agustin de la Rosa 774 Col. Italia Providencia, 44656 Guadalajara, Jal.,  Fraccionamiento Italia Providencia, Guadalajara",495,4.0,2.0,4.0,guadalajara,False
https://www.vivanuncios.com.mx/a-venta-casa/jardines-de-los-arcos/casa-en-venta-en-colonia-chapalita/146344239,Casa en Venta en Colonia Chapalita,7850000,"Calle de San Gabriel 588,  Jardines de los Arcos, Guadalajara",190,5.0,2.0,5.0,guadalajara,False
https://www.vivanuncios.com.mx/a-venta-casa/lomas-de-polanco/casa-venta-lomas-de-polanco/143129858,Casa Venta Lomas de Polanco,6800000,"Manuel Mena 3412,  Lomas de Polanco, Guadalajara",311,3.0,4.0,10.0,guadalajara,False
https://www.vivanuncios.com.mx/a-venta-casa/popular-hornos/casa-en-venta-en-av-rio-nilo-precio-terreno/146119203,"Casa en Venta en Av Rio Nilo, Precio Terreno",8220000,"Avenida Rio Nilo 6998,  Popular Hornos, Guadalajara",424,2.0,6.0,4.0,guadalajara,False
https://www.vivanuncios.com.mx/a-venta-casa/fraccionamiento-colomos-providencia/casa-en-venta-colomos-providencia/145040205,Casa en Venta Colomos Providencia,15500000,"Alberta 2206, Colomos Providencia,  Fraccionamiento Colomos Providencia, Guadalajara",455,2.0,4.0,2.0,guadalajara,False
https://www.vivanuncios.com.mx/a-venta-casa/miravalle/casas-en-venta-miravalle-guadalajara-jalisco/144439851,"Casas en Venta Miravalle, Guadalajara Jalisco.",2900000,"Grosellos 6,  Miravalle, Guadalajara",95,2.0,2.0,3.0,guadalajara,False
https://www.vivanuncios.com.mx/a-venta-casa/jardines-del-bosque/casa-en-venta-en-jardines-del-bosque-la-luna-2595/147085662,Casa en Venta en Jardines del Bosque - La Luna 2595,11550000,"Calle La Luna 2595,  Jardines del Bosque, Guadalajara",465,4.0,2.0,7.0,guadalajara,False
https://www.vivanuncios.com.mx/a-venta-casa/arcos-vallarta/casa-en-venta-en-arcos-vallarta-joaquin-arrieta-77/146776777,Casa en Venta en Arcos Vallarta - Joaquin Arrieta 77,6500000,"Joaquin Arriera 77,  Arcos Vallarta, Guadalajara",307,2.0,1.0,5.0,guadalajara,True
https://www.vivanuncios.com.mx/a-venta-casa/vallarta-poniente/casa-en-venta-en-vallarta-poniente-chapala-26/146585164,Casa en Venta en Vallarta Poniente - Chapala 26,13000000,"Chapala 26,  Vallarta Poniente, Guadalajara",418,3.0,4.0,7.0,guadalajara,True
https://www.vivanuncios.com.mx/a-venta-casa/fraccionamiento-jardines-de-la-cruz/casa-duplex-en-venta-en-jardines-de-la-cruz/145763870,Casa Duplex en Venta en Jardines de La Cruz,4699000,"Carabelas 1597, Fracc. Colon. Guadalajara Jal.,  Fraccionamiento Jardines de La Cruz, Guadalajara",183,3.0,3.0,6.0,guadalajara,False
https://www.vivanuncios.com.mx/a-venta-casa/fraccionamiento-independencia-oriente/casa-venta-indepencia-oriente-guadalajara-jalisco/90487369,"Casa Venta Indepencia Oriente, Guadalajara, Jalisco.",5600000,"Sierra Mojada 1564,  Fraccionamiento Independencia Oriente, Guadalajara",201,3.0,2.0,6.0,guadalajara,False
https://www.vivanuncios.com.mx/a-venta-casa/el-carmen/casa-en-venta-en-aboroledas-sur-valerio-trujano-4386/146451360,Casa en Venta en Aboroledas Sur - Valerio Trujano 4386,2600000,"Valerio Trujano 4386,  El Carmen, Guadalajara",176,3.0,1.0,3.0,guadalajara,False
https://www.vivanuncios.com.mx/a-venta-casa/providencia/casa-en-venta-providencia-guadalajara/145742789,"Casa en Venta, Providencia, Guadalajara",17990000,"monaco 2513,  Providencia, Guadalajara",499,4.0,4.0,6.0,guadalajara,True
https://www.vivanuncios.com.mx/a-venta-casa/1-de-mayo/se-vende-casa-en-obra-gris-chapultepec-country/146461174,Se Vende Casa en Obra Gris – Chapultepec Country,10500000,"Mar Rojo 1783,  Fraccionamiento Chapultepec Country, Guadalajara",267,5.0,2.0,4.0,guadalajara,False
https://www.vivanuncios.com.mx/a-venta-casa/fraccionamiento-vallarta-norte/casa-en-venta-en-napoleon/146132882,Casa en Venta en Napoleon,12500000,"Napoleon 180,  Fraccionamiento Vallarta Norte, Guadalajara",400,10.0,2.0,10.0,guadalajara,False
https://www.vivanuncios.com.mx/a-venta-casa/alcalde-barranquitas/casa-remate-bancario-av-de-los-maestros-436-colonia-alcalde-barranquitas/146207524,"Casa Remate Bancario Av de Los Maestros #436, Colonia Alcalde Barranquitas",878096,"Av. de los Maestros 436,  Alcalde Barranquitas, Guadalajara",204,2.0,2.0,3.0,guadalajara,False
https://www.vivanuncios.com.mx/a-venta-casa/circunvalacion-americas/casa-en-venta-o-renta-en-providencia/146932423,Casa en Venta o Renta en Providencia,35000000,"2622 C. Joaquin Angulo,  Circunvalacion Americas, Guadalajara",766,10.0,6.0,6.0,guadalajara,False
https://www.vivanuncios.com.mx/a-venta-casa/echeverria/casa-en-venta-colonia-echeverria/146326245,Casa en Venta Colonia Echeverría,3300000,"Gregorio Almada 1369,  Echeverria, Guadalajara",181,5.0,2.0,5.0,guadalajara,False
https://www.vivanuncios.com.mx/a-venta-casa/guadalajara/-casa-en-venta-en-guadalajara-3-recamaras-3-banos-completos-recamara-en-planta-baja-con-bano/146979468,*casa en Venta en Guadalajara* *3 Recamaras 3 Baños Completos* *recamara en Planta Baja con Baño*,3569000,"Calle Urbano San Roman 2637,  Guadalajara, Jalisco",61,3.0,1.0,3.0,guadalajara,False
https://www.vivanuncios.com.mx/a-venta-casa/la-federacha/casa-en-venta-en-colonia-la-federacha/146281198,Casa en Venta en Colonia La Federacha,2990000,"Prudencia 160,  La Federacha, Guadalajara",174,2.0,2.0,5.0,guadalajara,False
https://www.vivanuncios.com.mx/a-venta-casa/fraccionamiento-colinas-de-san-javier/casa-en-venta-en-colinas-de-san-javier/145797142,Casa en Venta en Colinas de San Javier,49000000,"Av Pablo Neruda 3366,  Fraccionamiento Colinas de San Javier, Guadalajara",1468,6.0,6.0,5.0,guadalajara,True
https://www.vivanuncios.com.mx/a-venta-casa/fraccionamiento-verde-valle/casa-en-venta-en-colonia-verde-valle/144735942,Casa en Venta en Colonia Verde Valle,13900000,"Avenida Topacio 2439,  Fraccionamiento Verde Valle, Guadalajara",600,6.0,4.0,4.0,guadalajara,False
https://www.vivanuncios.com.mx/a-venta-casa/barrio-san-juan-bosco/oportunidad-unica-casa-con-uso-de-suelo-mixto-en-excelente-estado-y-ubicacion/145318168,!oportunidad Única! Casa con Uso de Suelo Mixto en Excelente Estado y Ubicacion,3298000,"Manuel Cuesta Gallardo 117,  Barrio San Juan Bosco, Guadalajara",170,1.0,4.0,2.0,guadalajara,False
https://www.vivanuncios.com.mx/a-venta-casa/providencia-1a-secc/casa-en-venta-en-providencia/146007902,Casa en Venta en Providencia,9900000,"bogota 2660,  Providencia 1a Secc, Guadalajara",291,3.0,1.0,4.0,guadalajara,True
https://www.vivanuncios.com.mx/a-venta-casa/chapalita/-venta-casa-chapalita-oficinas-notaria-clinica-consultorios-etc/146170225,"¡Venta Casa Chapalita (Oficinas, Notaria, Clinica, Consultorios, Etc)",7000000,"Calle San Martin de Porres 3380,  Chapalita, Guadalajara",200,3.0,2.0,4.0,guadalajara,False
https://www.vivanuncios.com.mx/a-venta-casa/country-club/residencia-venta-country-club:-tu-hogar-tu-inversion/146674601,"Residencia Venta Country Club: Tu Hogar, Tu Inversión",22500000,"Calle Mar Rojo 2079,  Country Club, Guadalajara",426,6.0,5.0,5.0,guadalajara,False
https://www.vivanuncios.com.mx/a-venta-casa/monumental/residencia-venta-colonia-monumental/147006207,Residencia Venta Colonia Monumental,13700000,"Puerto Pichilingue 62,  Monumental, Guadalajara",550,3.0,4.0,2.0,guadalajara,True
https://www.vivanuncios.com.mx/a-venta-casa/providencia-1a-secc/casa-en-venta-en-providencia/146849732,Casa en Venta en Providencia,13350000,"Guayaquil 2730,  Providencia 1a Secc, Guadalajara",247,3.0,2.0,3.0,guadalajara,False
https://www.vivanuncios.com.mx/a-venta-casa/guadalajara/casa-en-venta-toltecas-3521-monraz/147072412,"Casa en Venta Toltecas #3521, Monraz",13490000,"Calle Toltecas 3521,  Guadalajara, Jalisco",436,3.0,6.0,3.0,guadalajara,True
https://www.vivanuncios.com.mx/a-venta-casa/fraccionamiento-colon-industrial/casa-en-venta/146958062,Casa en Venta,7000000,"Vasco Nunez de Balboa 2807,  Fraccionamiento Colon Industrial, Guadalajara",119,3.0,2.0,4.0,guadalajara,False
https://www.vivanuncios.com.mx/a-venta-casa/jardines-del-bosque-norte/casa-en-venta-en-jardines-del-bosque-guadalajara/144607484,Casa en Venta en Jardines del Bosque Guadalajara,7000000,"La Luna 2557,  Jardines del Bosque Norte, Guadalajara",275,1.0,3.0,7.0,guadalajara,False
https://www.vivanuncios.com.mx/a-venta-casa/jardines-de-san-jose/estrena-casa-en-residencial-victoria/145691135,Estrena Casa en Residencial Victoria,14899000,"Esmeralda 2940,  Jardines de San Jose, Guadalajara",290,4.0,4.0,4.0,guadalajara,False
https://www.vivanuncios.com.mx/a-venta-casa/fraccionamiento-colinas-de-san-javier/casa-de-un-nivel-en-colinas-de-san-javier/146871883,Casa de un Nivel en Colinas de San Javier,26000000,"Paseo del Torreon 1732,  Fraccionamiento Colinas de San Javier, Guadalajara",648,4.0,3.0,3.0,guadalajara,True
https://www.vivanuncios.com.mx/a-venta-casa/providencia/casa-en-venta-en-colomos-providencia-nueva-de-lujo-zona-providencia-zapopan/146979761,"Casa en Venta en Colomos Providencia Nueva de Lujo, Zona Providencia, Zapopan",32000000,"Brasilia 2875,  Providencia, Guadalajara",430,4.0,6.0,4.0,guadalajara,False
https://www.vivanuncios.com.mx/a-venta-casa/fraccionamiento-jardines-del-country/excelente-casa-en-venta-en-la-colonia-jardines-del-country-de-guadalajara/144963649,Excelente Casa en Venta en La Colonia Jardines del Country de Guadalajara,15500000,"Av. de la Presa 2003,  Fraccionamiento Jardines Del Country, Guadalajara",420,3.0,3.0,4.0,guadalajara,True
https://www.vivanuncios.com.mx/a-venta-casa/la-perla/casa-en-venta-en-coto-la-perla-guadalajara-hospital-civil-nuevo/147060250,"Casa en Venta en Coto La Perla, Guadalajara Hospital Civil Nuevo",2190000,"Calle Industria 421,  La Perla, Guadalajara",46,1.0,1.0,2.0,guadalajara,False
https://www.vivanuncios.com.mx/a-venta-casa/el-dean/casa-nueva-en-venta-3-recamaras-con-bano-cerca-del-centro-de-guadalajara/146777475,Casa Nueva en Venta | 3 Recámaras con Baño | Cerca del Centro de Guadalajara,3569000,"Urbano San Roman 2637,  El Dean, Guadalajara",61,3.0,1.0,3.0,guadalajara,False
https://www.vivanuncios.com.mx/a-venta-casa/vallarta-sur/av-inglaterra-enorme-casa-con-inmejorable-ubicacion/146690664,"Av Inglaterra, Enorme Casa con Inmejorable Ubicación.",28000000,"Inglaterra 32593 vallarta sur, guadalajara jalisco,  Vallarta Sur, Guadalajara",1099,5.0,6.0,7.0,guadalajara,True
https://www.vivanuncios.com.mx/a-venta-casa/fraccionamiento-jardines-del-country/casa-en-venta-jardines-del-country/146163943,Casa en Venta Jardines del Country,5750000,"LA PERPETUA 1626,  Fraccionamiento Jardines Del Country, Guadalajara",145,2.0,1.0,4.0,guadalajara,False
https://www.vivanuncios.com.mx/a-venta-casa/barrio-santa-teresita/departamentos-en-venta-en-col-santa-teresita-guadalajara-jal/146065591,"Departamentos en Venta, en Col. Santa Teresita, Guadalajara, Jal.",5985000,"ANASTACIO BUSTAMANTE 13,  Barrio Santa Teresita, Guadalajara",199,6.0,1.0,10.0,guadalajara,False
https://www.vivanuncios.com.mx/a-venta-casa/fraccionamiento-jardines-del-country/propiedad-en-venta-jardines-del-country/146939710,Propiedad en Venta Jardines del Country,6290000,"misioneros 2089,  Fraccionamiento Jardines Del Country, Guadalajara",185,4.0,2.0,3.0,guadalajara,False
