url,titulo,precio,m2_lote,m2_construccion,banos,medio_banos,estacionamientos,recamaras,antiguedad,direccion
https://www.vivanuncios.com.mx/a-venta-casa/zoquipan/casa-de-un-nivel-colonia-centrica-plaza-patria-escuelas-hospitales/146396993,"Casa de un Nivel Colonia Centrica, Plaza Patria, Escuelas, Hospitales","ventaMN 3,200,000",96²,68²,1,,1,2,30,"Beatriz Hernández 1190,  Zoquipan, Zapopan"
https://www.vivanuncios.com.mx/a-venta-casa/fraccionamiento-valle-imperial/casa-en-venta-en-valle-imperial-zapopan-jalisco/147014948,"Casa en Venta en Valle Imperial, Zapopan, Jalisco *","ventaMN 2,550,000",,,1,,2,3,,"895, Paseos del alva,  Fraccionamiento Valle Imperial, Zapopan"
https://www.vivanuncios.com.mx/a-venta-casa/paseos-del-briceno/lomas-del-briseno-casa-en-venta-grande-bien-iluminada-y-buen-ventilada/146737399,Lomas del Briseño Casa en Venta Grande Bien Iluminada y Buen Ventilada,"ventaMN 35,000,000",182²,320²,3,,5,3,1,"Paseo de La Familia 67 Paseis del Briseño,  Paseos Del Briceño, Zapopan"
https://www.vivanuncios.com.mx/a-venta-casa/fraccionamiento-valle-imperial/valle-imperial-coto-maya/146146562,Valle Imperial - Coto Maya,"ventaMN 4,100,000",160²,169²,3,,2,4,,"Imperio Maya-valle Imperial,  Fraccionamiento Valle Imperial, Zapopan"
https://www.vivanuncios.com.mx/a-venta-casa/el-bajio/casa-en-bajio-habitat/146999907,Casa en Bajio Habitat,"ventaMN 12,350,000",240²,330²,4,,3,4,,"Bajio Habitat,  El Bajío, Zapopan"
https://www.vivanuncios.com.mx/a-venta-casa/fraccionamiento-solares/casa-en-venta-en-soare-ii-solares-zapopan-jalisco/147014681,"Casa en Venta en Soare II, Solares, Zapopan, jalisco","ventaMN 9,800,000",,,3,,2,3,,"993 Paseo del anochecer,  Fraccionamiento Solares, Zapopan"
https://www.vivanuncios.com.mx/a-venta-casa/zapopan/casa-en-preventa-por-mariano-otero-zapopan-jalisco/147014905,"Casa en Preventa por Mariano Otero, Zapopan Jalisco.","ventaMN 3,780,000",84²,120²,2,,2,2,,"BARLOVENTO RESIDENCIAL,  Zapopan, Jalisco"
https://www.vivanuncios.com.mx/a-venta-casa/fraccionamiento-bugambilias/casa-en-venta-bugambilias/144617712,Casa en Venta Bugambilias,"ventaMN 19,500,000",1050²,1050²,3,2,2,3,10,"Vistas del sol,  Fraccionamiento Bugambilias, Zapopan"
https://www.vivanuncios.com.mx/a-venta-casa/fraccionamiento-valle-imperial/casa-en-valle-imperial/146855246,Casa en Valle Imperial,"ventaMN 8,300,000",160²,260²,4,1,2,4,,"Valle Imperial,  Fraccionamiento Valle Imperial, Zapopan"
https://www.vivanuncios.com.mx/a-venta-casa/fraccionamiento-puerta-las-lomas/casa-en-puerta-las-lomas/144434867,Casa en Puerta Las Lomas,"ventaMN 30,500,000",390²,390²,5,2,9,4,,"Puerta las Lomas,  Fraccionamiento Puerta Las Lomas, Zapopan"
https://www.vivanuncios.com.mx/a-venta-casa/fraccionamiento-residencial-amaranto/casa-en-venta/144676189,Casa en Venta,"ventaMN 2,523,000",123²,99²,2,1,2,3,5,"Casa EN Venta EN Fracc. Somos, Zapopan, Jalisco,  Fraccionamiento Residencial Amaranto, Zapopan"
https://www.vivanuncios.com.mx/a-venta-casa/fraccionamiento-valle-imperial/casa-en-venta-en-valle-imperial-zapopan-jalisco/147014091,"Casa en Venta en Valle Imperial, Zapopan Jalisco.","ventaMN 9,300,000",239²,297²,4,,3,4,,"92 pardo,  Fraccionamiento Valle Imperial, Zapopan"
https://www.vivanuncios.com.mx/a-venta-casa/ciudad-del-sol/casa-en-ciudad-del-sol-en-venta/144617543,Casa en Ciudad del Sol en Venta,"ventaMN 13,100,000",480²,480²,5,1,3,4,20,"Prado DE LOS Cedros,  Ciudad Del Sol, Zapopan"
https://www.vivanuncios.com.mx/a-venta-casa/la-higuera/casa-en-venta-la-higuera-zapopan-jalisco/147060809,Casa en Venta La Higuera Zapopan Jalisco,"ventaMN 1,150,000",95²,85²,1,,1,2,5,"la Higuera Zapopan al 100,  La Higuera, Zapopan"
https://www.vivanuncios.com.mx/a-venta-casa/los-pinos-campestre/venta-de-casa-campestre-los-pinos-coto-de-tres-casas-pegado-a-bugambilias/147014609,"Venta de Casa Campestre Los Pinos, Coto de Tres Casas Pegado a Bugambilias.","ventaMN 7,843,000",238²,274²,3,,2,4,,"7302 privada lorenzo barcelata,  Los Pinos Campestre, Zapopan"
https://www.vivanuncios.com.mx/a-venta-casa/puerta-de-hierro/casa-en-venta-en-puerta-de-hierro/144617780,Casa en Venta en Puerta de Hierro,"ventaMN 45,000,000",646²,646²,4,1,6,4,,"Puerta de Hierro,  Puerta de Hierro, Zapopan"
https://www.vivanuncios.com.mx/a-venta-casa/fraccionamiento-bugambilias/residencia-amplia-y-bonita/144617814,Residencia Amplia y Bonita,"ventaMN 13,000,000",613²,613²,6,,3,4,,"Circuito de las Flores Norte,  Fraccionamiento Bugambilias, Zapopan"
https://www.vivanuncios.com.mx/a-venta-casa/fraccionamiento-residencial-san-isidro/casa-en-venta-en-residencial-san-isidro-zapopan-jalisco/147014176,"Casa en Venta en Residencial San Isidro, Zapopan, jalisco","ventaMN 3,850,000",108²,147²,2,,2,3,,"222 AV. PASEO DE LA CASTILLA,  Fraccionamiento Residencial San Isidro, Zapopan"
https://www.vivanuncios.com.mx/a-venta-casa/fraccionamiento-jardin-real/hermosa-residencia-de-oportunidad-en-jardin-real/147062800,Hermosa Residencia de Oportunidad en Jardín Real,"ventaMN 8,800,000",300²,300²,3,1,3,3,17,"Duque ,  Fraccionamiento Jardín Real, Zapopan"
https://www.vivanuncios.com.mx/a-venta-casa/zapopan/casa-en-capital-norte/145881560,Casa en Capital Norte,"ventaMN 4,299,000",115²,197²,3,1,2,3,,"Capital Norte,  Zapopan, Jalisco"
https://www.vivanuncios.com.mx/a-venta-casa/fraccionamiento-mirador-del-bosque/casa-en-privada-fiori/145897067,Casa en Privada Fiori,"ventaMN 1,178,000",72²,63²,1,1,1,2,,"Casa Dalia,  Fraccionamiento Mirador del Bosque, Zapopan"
https://www.vivanuncios.com.mx/a-venta-casa/bosques-vallarta/casa-en-venta/144265805,Casa en Venta,"ventaMN 10,000,000",212²,282²,4,,2,2,,"Casa EN Venta EN Parques Vallarta, Acacia, Zapopan, Jalisco,  Bosques Vallarta, Zapopan"
https://www.vivanuncios.com.mx/a-venta-casa/fraccionamiento-solares/casa-en-venta-soare/145281151,Casa en Venta Soare,"ventaMN 8,695,000",148²,215²,4,1,2,4,,"Avenida Paseo del Anochecer,  Fraccionamiento Solares, Zapopan"
https://www.vivanuncios.com.mx/a-venta-casa/altavista-residencial/vitana-residencial-hermosa-casa-en-venta/146981273,"Vitana Residencial, Hermosa Casa en Venta","ventaMN 5,450,000",107²,195²,4,,2,4,,"Vitana Residencial,  Altavista Residencial, Zapopan"
https://www.vivanuncios.com.mx/a-venta-casa/fraccionamiento-jardin-real/casa-en-venta-en-armonia-habitat-jardin-real-zapopan-jal/147014851,"Casa en Venta en Armonia Habitat. Jardin Real, Zapopan Jal.","ventaMN 4,160,000",97²,150²,2,,2,3,,"6170 Base Area,  Fraccionamiento Jardín Real, Zapopan"
https://www.vivanuncios.com.mx/a-venta-casa/zapopan/venta-de-casa-dentro-de-coto-parques-vallarta-zapopan/147014824,"Venta de Casa Dentro de Coto, Parques Vallarta, Zapopan","ventaMN 7,300,000",163²,230²,4,,3,4,,"2055 Av paseo del parque,  Zapopan, Jalisco"
https://www.vivanuncios.com.mx/a-venta-casa/zapopan/casa-en-venta/143931987,Casa en Venta,"ventaMN 12,500,000",304²,331²,2,2,4,5,50,"Casa EN Venta EN Col. Providencia, Guadalajara, Jalisco,  Zapopan, Jalisco"
https://www.vivanuncios.com.mx/a-venta-casa/fraccionamiento-solares/casa-en-solares/146855245,Casa en Solares,"ventaMN 7,200,000",146²,210²,2,1,2,3,,"Solares,  Fraccionamiento Solares, Zapopan"
https://www.vivanuncios.com.mx/a-venta-casa/loma-bonita/casa-loma-bonita/146627696,Casa Loma Bonita,"ventaMN 6,500,000",1²,1²,3,1,2,3,,"Calle Mojarra 3917,  Loma Bonita, Zapopan"
https://www.vivanuncios.com.mx/a-venta-casa/ciudad-bugambilia/increible-casa-con-vista-panoramica-zapopan-jalisco-cd-bugambilias/146908138,Increíble Casa con Vista Panorámica / Zapopan Jalisco / Cd. Bugambilias,"ventaMN 12,100,000",313²,334²,4,,4,4,12,"Av Lomas de Bugambilias,  Ciudad Bugambilia, Zapopan"
https://www.vivanuncios.com.mx/a-venta-casa/residencial-del-bosque/amplia-residencia-remodelada-en-venta/146913122,Amplia Residencia Remodelada en Venta,"ventaMN 14,899,000",290²,490²,4,2,4,4,,"Calle Esmeralda 2940,  Residencial Del Bosque, Zapopan"
https://www.vivanuncios.com.mx/a-venta-casa/rancho-nuevo-de-tesistan/edificio-en-venta-en-col-rancho-nuevo-guadalajara/147035400,"Edificio en Venta en Col. Rancho Nuevo, Guadalajara","ventaMN 4,090,000",325²,325²,6,2,1,6,,"Juan B. Bandeja al 4300,  Rancho Nuevo de Tesistán, Zapopan"
https://www.vivanuncios.com.mx/a-venta-casa/nuevo-mexico/casa-en-rinconadas-de-zapopan/146958515,Casa en Rinconadas de Zapopan,"ventaMN 2,190,000",85²,74²,1,1,1,2,15,"Calle Rinconada de los Naranjos ,  Nuevo México, Zapopan"
https://www.vivanuncios.com.mx/a-venta-casa/zapopan/casa-en-venta-en-capital-norte/146921262,Casa en Venta en Capital Norte,"ventaMN 4,400,000",196²,196²,3,,2,4,,"Capital Norte,  Zapopan, Jalisco"
https://www.vivanuncios.com.mx/a-venta-casa/fraccionamiento-valle-imperial/casa-valle-imperial-super-equipada-y-moderna/143898383,Casa Valle Imperial Super Equipada y Moderna,"ventaMN 9,800,000",160²,327²,4,1,3,3,3,"Bv. Valle Imperial,  Fraccionamiento Valle Imperial, Zapopan"
https://www.vivanuncios.com.mx/a-venta-casa/puerta-de-hierro/casa-en-puerta-de-hierro/144617718,Casa en Puerta de Hierro,"ventaMN 20,500,000",470²,470²,3,1,2,3,15,"Puerto de Hierro,  Puerta de Hierro, Zapopan"
https://www.vivanuncios.com.mx/a-venta-casa/rio-blanco/casa-en-venta-nueva-argenta/144617760,Casa en Venta Nueva - Argenta,"ventaMN 6,995,000",170²,170²,3,1,2,4,,"av rio Blanco 1900,  Rio Blanco, Zapopan"
https://www.vivanuncios.com.mx/a-venta-casa/el-centinela/hermosa-y-acogedora-casa-en-venta-en-zoi-canadas/143298334,Hermosa y Acogedora Casa en Venta en Zoí Cañadas.,"ventaMN 3,850,000",80²,140²,3,1,2,3,4,"Avenida Paseo de las Aves 2442-interior 141,  El Centinela, Zapopan"
https://www.vivanuncios.com.mx/a-venta-casa/lomas-del-batan/se-vende-casa-a-precio-de-terreno-en-colonia-el-batan/146735267,Se Vende Casa a Precio de Terreno en Colonia El Batan,"ventaMN 2,890,000",300²,200²,1,,,1,35,"Calle Morelos 393,  Lomas Del Batan, Zapopan"
https://www.vivanuncios.com.mx/a-venta-casa/puerta-de-hierro/venta-de-casa-en-puerta-de-hierro-residencial/144617546,Venta de Casa en Puerta de Hierro Residencial,"ventaMN 47,000,000",1100²,1100²,5,3,9,4,20,"Blvrd Puerta de Hierro,  Puerta de Hierro, Zapopan"
https://www.vivanuncios.com.mx/a-venta-casa/el-fortin/venta-de-casa-en-los-robles-zapopan/147039953,Venta de Casa en Los Robles Zapopan,"ventaMN 7,700,000",258²,320²,4,2,3,5,7,"AV. Paseo DE LOS Robles,  El Fortín, Zapopan"
https://www.vivanuncios.com.mx/a-venta-casa/colli-ctm/hermosas-casas-en-el-mismo-terreno-oportunidad-para-inversionistas/146830635,Hermosas Casas en El Mismo Terreno Oportunidad Para Inversionistas,"ventaMN 10,900,000",689²,464²,5,1,4,8,20,"Calle Volcán Cofre de Perote 117,  Colli C.T.M., Zapopan"
https://www.vivanuncios.com.mx/a-venta-casa/colinas-de-san-javier/casa-en-venta/147088313,Casa en Venta,"ventaMN 28,125,000",1250²,1250²,,,,,,"Terreno EN Venta EN Colinas DE SAN Javier, Zapopan, Jalisco,  Colinas de San Javier, Zapopan"
https://www.vivanuncios.com.mx/a-venta-casa/villa-universitaria/casa-nueva-en-venta-villa-universitaria-zapopan/144720119,"Casa Nueva en Venta Villa Universitaria, Zapopan","ventaMN 20,283,320",322²,314²,3,1,4,3,,"Paseo de los Parques,  Villa Universitaria, Zapopan"
https://www.vivanuncios.com.mx/a-venta-casa/las-canadas/casa-en-las-canadas/146540332,Casa en Las Cañadas,"ventaMN 4,700,000",200²,158²,2,1,2,3,,"Camino de los Parques 3880,  Las Cañadas, Zapopan"
https://www.vivanuncios.com.mx/a-venta-casa/zapopan/casa-en-venta-en-solares-zapopan-jalisco/147014173,"Casa en Venta en Solares, Zapopan, Jalisco","ventaMN 9,990,000",212²,282²,4,,2,3,,"2055 Paseo del parque,  Zapopan, Jalisco"
https://www.vivanuncios.com.mx/a-venta-casa/arenales-tapatios/casa-en-arenales-tapatios/146606402,Casa en Arenales Tapatíos,"ventaMN 4,899,000",200²,395²,9,,,9,25,"Platino  al 2500,  Arenales Tapatíos, Zapopan"
https://www.vivanuncios.com.mx/a-venta-casa/fraccionamiento-residencial-amaranto/casa-en-condominio-en-5-valles/145897092,Casa en Condominio en 5 Valles,"ventaMN 2,645,000",83²,130²,3,1,2,3,,"Casa Pradera,  Fraccionamiento Residencial Amaranto, Zapopan"
https://www.vivanuncios.com.mx/a-venta-casa/fraccionamiento-mirador-del-bosque/casa-de-2-recamaras-patio-y-cochera/147015073,"Casa de 2 Recámaras, Patio y Cochera","ventaMN 1,247,000",72²,63²,1,,1,2,,"8.5 Carr a Colotlán,  Fraccionamiento Mirador del Bosque, Zapopan"
https://www.vivanuncios.com.mx/a-venta-casa/las-canadas/casa-en-venta-en-las-canadas-en-zapopan/144455111,Casa en Venta en Las Cañadas en Zapopan,"ventaMN 4,380,000",200²,200²,2,1,3,3,,"Camino de los Parques 3880, Colinas de San Isidro, Zapopan, Jalisco,  Las Cañadas, Zapopan"
https://www.vivanuncios.com.mx/a-venta-casa/fraccionamiento-valle-imperial/hermosa-casa-en-valle-imperial/146779812,Hermosa Casa en Valle Imperial!,"ventaMN 4,800,000",160²,240²,2,2,2,3,,"Valle Imperial,  Fraccionamiento Valle Imperial, Zapopan"
https://www.vivanuncios.com.mx/a-venta-casa/zapopan/-hogar-en-los-robles-zapopan/147014284,"""Hogar en Los Robles, Zapopan""","ventaMN 8,780,000",282²,266²,3,,4,3,,"314 Av Paseo de los Robles Norte,  Zapopan, Jalisco"
https://www.vivanuncios.com.mx/a-venta-casa/ciudad-bugambilia/casa-en-venta-bugambilias-primera-seccion-circuito-de-las-flores-poniente/146859566,Casa en Venta Bugambilias Primera Sección Circuito de Las Flores Poniente,"ventaMN 14,734,000",700²,680²,4,2,4,4,,"Bugambilias Circuito de las Flores Poniente,  Ciudad Bugambilia, Zapopan"
https://www.vivanuncios.com.mx/a-venta-casa/fraccionamiento-solares/hermosa-casa-en-venta-en-solares/146843735,Hermosa Casa en Venta en Solares,"ventaMN 7,920,000",133²,182²,,,,,,"Solares - Privanza Terma,  Fraccionamiento Solares, Zapopan"
https://www.vivanuncios.com.mx/a-venta-casa/el-bajio/el-bajio-habitat-residencia-de-oportunidad-en-esquina-cerca-del-bos/146678348,"El Bajío Hábitat, Residencia de Oportunidad, en Esquina, Cerca del Bos","ventaMN 12,350,000",330²,330²,5,,3,4,3,"Camino Arenero 1052,  El Bajío, Zapopan"
https://www.vivanuncios.com.mx/a-venta-casa/zapopan/casa-en-venta-en-barlovento-residencial-zapopan-jal/147014296,"Casa en Venta en Barlovento Residencial, Zapopan Jal.","ventaMN 4,320,000",84²,131²,3,,2,3,,"2400 prolongacion guardia nacional,  Zapopan, Jalisco"
https://www.vivanuncios.com.mx/a-venta-casa/fraccionamiento-bugambilias/residencia-amplia-y-bonita/144617812,Residencia Amplia y Bonita,"ventaMN 13,000,000",613²,613²,6,,3,4,,"Circuito de las Flores Norte,  Fraccionamiento Bugambilias, Zapopan"
https://www.vivanuncios.com.mx/a-venta-casa/puerta-de-hierro/casa-puerta-de-hierro/146060417,Casa - Puerta de Hierro,"ventaMN 63,000,000",1400²,900²,4,4,8,4,,"Puerta de Hierro, Zapopan.,  Puerta de Hierro, Zapopan"
https://www.vivanuncios.com.mx/a-venta-casa/ciudad-granja/casa-sobre-av-colonia-el-fortin/146380951,Casa Sobre Av Colonia El Fortin,"ventaMN 3,300,000",104²,135²,2,1,2,3,,"Calle Zafiro 2,  Ciudad Granja, Zapopan"
https://www.vivanuncios.com.mx/a-venta-casa/fraccionamiento-valle-imperial/casa-en-venta-en-capital-norte/144768124,Casa en Venta en Capital Norte,"ventaMN 5,550,000",165²,217²,4,1,2,4,,"Casa en Venta en Capital Norte,  Fraccionamiento Valle Imperial, Zapopan"
https://www.vivanuncios.com.mx/a-venta-casa/la-moraleja/casa-en-venta-la-moraleja-coto-madrid/146777007,Casa en Venta La Moraleja Coto Madrid,"ventaMN 1,680,000",70²,79²,2,,,3,6,"La moraleja,  La Moraleja, Zapopan"
https://www.vivanuncios.com.mx/a-venta-casa/puerta-de-hierro/residencia-en-venta-en-puerta-de-hierro/144617648,Residencia en Venta en Puerta de Hierro,"ventaMN 35,900,000",800²,800²,5,,4,3,5,"Puerta DE Hierro,  Puerta de Hierro, Zapopan"
https://www.vivanuncios.com.mx/a-venta-casa/fraccionamiento-bugambilias/casa-en-nueva-en-residecial-puerta-azaleas-en-zapopan-jalisco/145463975,Casa en Nueva en Residecial Puerta Azaleas en Zapopan Jalisco,"ventaMN 12,500,000",250²,310²,4,1,2,4,,"Calle Azaleas 573 int 113 Ciudad Bugambilias Zapopan,  Fraccionamiento Bugambilias, Zapopan"
https://www.vivanuncios.com.mx/a-venta-casa/mesa-de-los-ocotes/casa-en-venta/146115224,Casa en Venta,"ventaMN 6,990,000",130²,201²,4,1,3,3,,"Casa en Venta Fracc. Solares, Av Paseo de los Eucalipto, Zapopan,  Mesa de los Ocotes, Zapopan"
https://www.vivanuncios.com.mx/a-venta-casa/zapopan/casa-en-venta-en-el-briseno-en-santa-ana-tepetitlan-zapopan-jalisco-mexico/147015000,"Casa en Venta en El Briseño en Santa Ana Tepetitlan, Zapopan Jalisco, México","ventaMN 2,850,000",154²,161²,2,,1,4,,"23 SAN FRANCISCO,  Zapopan, Jalisco"
https://www.vivanuncios.com.mx/a-venta-casa/fraccionamiento-solares/casa-en-venta/144265225,Casa en Venta,"ventaMN 10,500,000",191²,268²,4,,2,3,,"Casa EN Venta EN Altanza, Zapopan, Jalisco,  Fraccionamiento Solares, Zapopan"
https://www.vivanuncios.com.mx/a-venta-casa/fraccionamiento-residencial-santa-fe/casa-a-5-minutos-de-zona-real/146474677,Casa a 5 Minutos de Zona Real,"ventaMN 3,000,000",106²,140²,2,,2,3,10,"Cocoteros no. 18,  Fraccionamiento Residencial Santa Fe, Zapopan"
https://www.vivanuncios.com.mx/a-venta-casa/fraccionamiento-camino-real/casa-en-venta-en-camino-real-zapopan-jalisco/146058175,Casa en Venta en Camino Real Zapopan Jalisco,"ventaMN 17,950,000",300²,479²,5,1,4,5,15,"Camino Real,  Fraccionamiento Camino Real, Zapopan"
https://www.vivanuncios.com.mx/a-venta-casa/fraccionamiento-valle-imperial/venta-de-casa-nueva-inteligencia-tecnologia-sustentabilidad/147014628,Venta de Casa Nueva. Inteligencia + Tecnologia + Sustentabilidad,"ventaMN 4,390,000",115²,170²,4,,2,3,,"575 AV D,  Fraccionamiento Valle Imperial, Zapopan"
https://www.vivanuncios.com.mx/a-venta-casa/fraccionamiento-valle-imperial/casa-en-valle-imperial/145749418,Casa en Valle Imperial,"ventaMN 4,950,000",160²,240²,2,2,2,3,,"Valle Imperial,  Fraccionamiento Valle Imperial, Zapopan"
https://www.vivanuncios.com.mx/a-venta-casa/puerta-de-hierro/casa-en-venta-amueblada-puerta-de-hierro/144617602,Casa en Venta Amueblada Puerta de Hierro,"ventaMN 49,750,000",900²,900²,5,3,6,4,25,"Blvd Puerta DE Hierro,  Puerta de Hierro, Zapopan"
https://www.vivanuncios.com.mx/a-venta-casa/fraccionamiento-jardines-de-las-fuentes/casa-en-venta-en-belissimo-habitat-residencial/146923996,Casa en Venta en Belissimo Habitat Residencial,"ventaMN 2,200,000",79²,104²,2,1,1,2,8,"Via Belissimo 43 Coto Florencia,  Fraccionamiento Jardines de Las Fuentes, Zapopan"
https://www.vivanuncios.com.mx/a-venta-casa/fraccionamiento-solares/casa-en-venta-en-soare-ii-solares-zapopan-jal/147014020,"Casa en Venta en Soare II, Solares, Zapopan, jal","ventaMN 8,600,000",152²,225²,4,,2,3,,"993 Paseo del anochecer,  Fraccionamiento Solares, Zapopan"
https://www.vivanuncios.com.mx/a-venta-casa/lomas-de-la-primavera/casa-en-venta-en-lomas-de-la-primavera/146687486,Casa en Venta en Lomas de La Primavera,"ventaMN 1,950,000",140²,260²,3,,2,3,5,"Miguel de la Madrid,  Lomas de La Primavera, Zapopan"
https://www.vivanuncios.com.mx/a-venta-casa/nuevo-mexico/lujosa-casa-en-venta-capital-norte-coto-sienna/147049261,Lujosa Casa en Venta Capital Norte Coto Sienna,"ventaMN 4,990,000",115²,190²,3,1,2,4,,"Av. Paseo de la Cantera 702,  Nuevo México, Zapopan"
https://www.vivanuncios.com.mx/a-venta-casa/los-robles/casa-en-los-robles/146565640,Casa en Los Robles,"ventaMN 8,670,000",269²,269²,4,,3,4,,"Los Robles,  Los Robles, Zapopan"
https://www.vivanuncios.com.mx/a-venta-casa/arcos-de-guadalupe/casa-en-venta-arcos-de-guadalupe/146335617,Casa en Venta Arcos de Guadalupe,"ventaMN 27,000,000",625²,800²,6,3,6,6,,"Calle Economos,  Arcos de Guadalupe, Zapopan"
https://www.vivanuncios.com.mx/a-venta-casa/valle-real/casa-en-venta-en-valle-real/146739944,Casa en Venta en Valle Real,"ventaMN 16,000,000",330²,330²,3,1,6,4,,"Valle Real - Coto SAN Rafael,  Valle Real, Zapopan"
https://www.vivanuncios.com.mx/a-venta-casa/fraccionamiento-mirador-del-bosque/casa-en-privada-fiori/145897091,Casa en Privada Fiori,"ventaMN 1,307,000",72²,72²,2,,1,2,,"Casa Violeta,  Fraccionamiento Mirador del Bosque, Zapopan"
https://www.vivanuncios.com.mx/a-venta-casa/el-centinela/casa-nueva-frente-a-parque/146698791,Casa Nueva Frente a Parque,"ventaMN 7,150,000",257²,382²,4,1,4,4,,"Calle Prolongación Belenes,  El Centinela, Zapopan"
https://www.vivanuncios.com.mx/a-venta-casa/jardines-del-valle/casa-en-residencial-del-valle-zapopan/145023284,"Casa en Residencial del Valle, Zapopan.","ventaMN 3,600,000",98²,112²,2,1,2,4,24,"Residencial DEL Valle,  Jardines del Valle, Zapopan"
https://www.vivanuncios.com.mx/a-venta-casa/zapopan/casa-en-venta-en-capital-norte/144976955,Casa en Venta en Capital Norte,"ventaMN 4,100,000",112²,163²,2,1,2,3,,"Casa Capital Norte,  Zapopan, Jalisco"
https://www.vivanuncios.com.mx/a-venta-casa/arcos-de-guadalupe/casa-en-venta-arcos-de-guadalupe/146335616,Casa en Venta Arcos de Guadalupe,"ventaMN 27,000,000",625²,800²,6,3,6,6,,"Calle Economos,  Arcos de Guadalupe, Zapopan"
https://www.vivanuncios.com.mx/a-venta-casa/las-canadas/residencia-en-venta-en-las-canadas-zapopan-jalisco/145160364,"Residencia en Venta en Las Cañadas, Zapopan, Jalisco","ventaMN 8,900,000",327²,176²,3,1,2,3,25,"PASEO DE LOS LAGOS #61,  Las Cañadas, Zapopan"
https://www.vivanuncios.com.mx/a-venta-casa/fraccionamiento-albaterra/casa-en-albaterra-zapopan/145897070,Casa en Albaterra Zapopan,"ventaMN 2,083,108",128²,98²,2,1,2,3,,"Casa Tabachin,  Fraccionamiento Albaterra, Zapopan"
https://www.vivanuncios.com.mx/a-venta-casa/fraccionamiento-solares/hermosa-casa-en-venta-en-solares/146844054,Hermosa Casa en Venta en Solares,"ventaMN 7,590,000",132²,776²,2,2,2,4,,"Solares - Privanza Terma,  Fraccionamiento Solares, Zapopan"
https://www.vivanuncios.com.mx/a-venta-casa/fraccionamiento-bugambilias/casa-en-venta-en-fraccionamiento-bugambilias-zapopan-jalisco/142042912,Casa en Venta en Fraccionamiento Bugambilias Zapopan Jalisco,"ventaMN 11,900,000",525²,400²,5,1,4,4,,"Bugambilias,  Fraccionamiento Bugambilias, Zapopan"
https://www.vivanuncios.com.mx/a-venta-casa/los-guayabos/casa-con-terraza-50-personas-cerca-del-bosque-en-zapopan-jalisco/146674869,"Casa con Terraza (50 Personas) Cerca del Bosque en Zapopan, Jalisco","ventaMN 6,250,000",314²,300²,1,3,6,2,,"Avenida Doctor Angel Leaño ,  Los Guayabos, Zapopan"
https://www.vivanuncios.com.mx/a-venta-casa/el-colli-urbano/casa-en-el-colli/147026812,Casa en El Colli,"ventaMN 4,200,000",100²,100²,1,1,2,3,25,"VOLCAN AJUSTO 1497,  El Colli Urbano, Zapopan"
https://www.vivanuncios.com.mx/a-venta-casa/los-robles/casa-en-los-robles/145348045,Casa en Los Robles,"ventaMN 7,500,000",230²,230²,3,1,3,3,,"Los Robles,  Los Robles, Zapopan"
https://www.vivanuncios.com.mx/a-venta-casa/zapopan/casa-en-venta-en-valle-real-dentro-de-coto-ciruelos/147014047,Casa en Venta en Valle Real Dentro de Coto Ciruelos.,"ventaMN 15,900,000",423²,290²,3,,4,4,,"Av. Pase San Arturo Ote 413 condominio ciruelos casa 3,  Zapopan, Jalisco"
https://www.vivanuncios.com.mx/a-venta-casa/fraccionamiento-puerta-del-bosque/casa-en-condominio-puerta-del-bosque/144803319,Casa en Condominio Puerta del Bosque,"ventaMN 28,000,000",430²,432²,4,1,1,3,1,"Puerta del Bosque,  Fraccionamiento Puerta del Bosque, Zapopan"
https://www.vivanuncios.com.mx/a-venta-casa/puerta-de-hierro/casa-en-galicia-fraccionamiento-puerta-de-hierro/144947779,Casa en Galicia Fraccionamiento Puerta de Hierro,"ventaMN 76,000,000",1518²,2559²,5,1,6,5,20,"Galicia en Puerta de Hierro,  Puerta de Hierro, Zapopan"
https://www.vivanuncios.com.mx/a-venta-casa/fraccionamiento-residencial-amaranto/casa-en-venta/144676438,Casa en Venta,"ventaMN 2,871,000",123²,140²,2,2,3,3,5,"Casa EN Venta AV Amaranto, Fracc. Somos, Zapopan, Jalisco,  Fraccionamiento Residencial Amaranto, Zapopan"
https://www.vivanuncios.com.mx/a-venta-casa/fraccionamiento-valle-imperial/trato-directo-hermosa-residencia-a-estrenar-en-capital-norte-coto-alicante/146746471,Trato Directo Hermosa Residencia a Estrenar en Capital Norte Coto Alicante,"ventaMN 4,425,000",115²,177²,3,,2,3,,"Av. F ,  Fraccionamiento Valle Imperial, Zapopan"
https://www.vivanuncios.com.mx/a-venta-casa/residencial-plaza-guadalupe/casa-en-buena-zona-excelente-estado/147000366,"Casa en Buena Zona, Excelente Estado","ventaMN 3,390,000",77²,87²,2,,1,3,18,"Misión de Santo Tomás ,  Residencial Plaza Guadalupe, Zapopan"
https://www.vivanuncios.com.mx/a-venta-casa/fraccionamiento-jardines-de-san-ignacio/casa-en-jardines-de-san-ignacio-junto-a-chapalita-de-1-planta-con-alberca-y-terraza/146811062,"Casa en Jardines de San Ignacio, Junto a Chapalita de 1 Planta con Alberca y Terraza","ventaMN 12,500,000",477²,377²,3,1,2,3,35,"San Roman al 1300,  Fraccionamiento Jardines de San Ignacio, Zapopan"
https://www.vivanuncios.com.mx/a-venta-casa/zapopan/casa-en-venta-en-solares-en-coto-soare-ii-zapopan-jal/147015129,"Casa en Venta en Solares en Coto Soare II Zapopan, Jal.","ventaMN 7,700,000",152²,208²,5,,2,5,,"-,  Zapopan, Jalisco"
https://www.vivanuncios.com.mx/a-venta-casa/zapopan/casa-en-venta-en-alba-residencial-capital-norte/146852491,"Casa en Venta en Alba Residencial, Capital Norte","ventaMN 2,850,000",92²,107²,2,1,2,2,,"Capital Norte,  Zapopan, Jalisco"
https://www.vivanuncios.com.mx/a-venta-casa/el-fortin/casa-en-venta-dentro-de-coto-por-mariano-otero-zapopan/147015018,"Casa en Venta Dentro de Coto por Mariano Otero, Zapopan.","ventaMN 4,490,000",84²,138²,3,,2,3,,"125 Prolongación guardia nacional,  El Fortín, Zapopan"
https://www.vivanuncios.com.mx/a-venta-casa/fraccionamiento-residencial-parques-de-tesistan/casa-en-parques-de-tesistan-iii/147069202,Casa en Parques de Tesistan III,"ventaMN 1,899,000",87²,87²,,2,2,3,6,"Parques de Tesistan III,  Fraccionamiento Residencial Parques de Tesistán , Zapopan"
https://www.vivanuncios.com.mx/a-venta-casa/fraccionamiento-valle-imperial/casa-en-carrara-capital-norte/145348100,Casa en Carrara Capital Norte,"ventaMN 4,500,000",120²,120²,4,1,2,,,"Carrara,  Fraccionamiento Valle Imperial, Zapopan"
